Comment,Vader score,Vader label,TextBlob score,TextBlob label,BERT score,BERT label
These plastic people make me sick xd,0.128,Positive,-0.7142857142857143,Negative,-0.6340950131416321,Negative
I love how I got a plastic surgery “cheek lift” ad before this video started,0.6369,Positive,0.5,Positive,0.6041301488876343,Positive
Edgar is so cute ;),0.7223,Positive,0.375,Positive,0.5888016819953918,Positive
Please stop making videos with this guy. Nothing against him but it's not as entertaining with someone else involved,-0.4694,Negative,0.5,Positive,-0.3744334280490875,Negative
13ken :(,-0.4404,Negative,-0.75,Negative,0.2530175447463989,Neutral
"The first lady wants the smallest waist, but no matter how small she gets, there'll be some petit small boned girl that will have a smaller waist.",-0.0286,Neutral,-0.0099999999999999,Negative,0.5076132416725159,Positive
Don’t lump normal doctors in with irresponsible plastic surgeons ! they are not the same profession!,-0.5399,Negative,0.09375,Positive,-0.5523948669433594,Negative
😭😂😭😂😭😂”no I can’t do it. 🛍🍍🧀🥚🍞🥩🥦”,-0.7579,Negative,0.0,Neutral,-0.5813618898391724,Negative
Ew there all disgusting,-0.5267,Negative,-1.0,Negative,-0.8428981900215149,Negative
Will u ever bring back the BroKen podcast in the future? 🥺,-0.4767,Negative,-0.1333333333333333,Negative,-0.3326011300086975,Negative
I don’t think both of you have great chemistry 😢,0.25,Positive,0.8,Positive,0.3641089797019958,Positive
God pewds how do you like ken?... He can't even understand what youre saying about your perspective on working out. I remember the stuff you used to post when you were talking about politics and your philosophy on life. I really enjoyed your content. He seems like someone that you used to talk down on.,0.8655,Positive,0.1722222222222222,Positive,0.5388350486755371,Positive
KEK SUCKS!,-0.4199,Negative,-0.375,Negative,-0.8101043701171875,Negative
worst plastic surgery?...wheres Oily Sunburn also known as oily london,-0.6249,Negative,-1.0,Negative,-0.7811003923416138,Negative
You missed Gabi demartino,-0.296,Negative,0.0,Neutral,0.2480009943246841,Neutral
Great collab,0.6249,Positive,0.8,Positive,0.7281678318977356,Positive
glad this was posted on my birthday lmfao,0.7579,Positive,0.5,Positive,0.6320455074310303,Positive
I’m small and just wanna give people better days!,0.4926,Positive,0.1875,Positive,0.3673357665538788,Positive
"It always kinda makes me sad to see celebrities get intense plastic surgery when they get older so that they don't look old, but I feel like most of them could age really well and still be beautiful if they just age naturally. That girl Hang Mioku would have aged very nicely I think if she had done it naturally. I think that Dolly Parton would have also looked really pretty if she hadn't gotten so much plastic surgery but she still is very beautiful.",0.9813,Positive,0.2747619047619048,Positive,0.4876018762588501,Positive
For some reason I was waiting for Oli London,0.0,Neutral,0.0,Neutral,0.4173493981361389,Positive
I’ve finally decided to purchase the NordVPN. You sold me on it Pews. Should I add the NordPass too?,0.0,Neutral,0.0,Neutral,-0.2770232558250427,Negative
"Ken already is hot AF, no need for change 😍",0.2023,Positive,0.25,Positive,0.3641412854194641,Positive
the commentor sounds like NemRaps,0.3612,Positive,0.0,Neutral,-0.413225769996643,Negative
Obviously anyone who goes this far has mental issues and yes doctors are 100% responsible for saying this is no longer in your best interest. I often think about how Michael Jackson's nose literally fell off his face.,0.875,Positive,0.24,Positive,-0.6862509846687317,Negative
This is actually very sad and disturbing.,-0.788,Negative,-0.575,Negative,-0.6995198726654053,Negative
Surgical addiction is actually mentioned in the APA manual…,0.0,Neutral,0.0,Neutral,0.2308201938867569,Neutral
Igor and Grichka had recently died from COVID….,-0.5574,Negative,0.0,Neutral,0.2681914269924164,Neutral
Give me your dog 🤲,0.0,Neutral,0.0,Neutral,0.5731712579727173,Positive
"you really should have watched it all. that last one she did herself and it got that bad. i know many will seek out ""doctors"" in 3rd world counties casue they will do anything for money and most dont have any license or education on what they are doing. people go to them due to cheaper but also they get a yes when any sane legal doctor would say no.",0.4678,Positive,0.071875,Positive,-0.7364834547042847,Negative
"Alimony isn't even to pay for child support. It's so the ex-wife can ""live the lifestyle she's accustomed to."" It's basically all bullshit, DR. Dre just had to do the same thing and pay his ex-wife like 2 mil a year or something ridiculous.",-0.2969,Negative,-0.0656565656565656,Negative,-0.659713864326477,Negative
How you think all of those women these days get those GIGANTIC asses?!,0.0,Neutral,0.0,Neutral,0.5527610182762146,Positive
,0.0,Neutral,0.0,Neutral,0.2846148908138275,Neutral
Pixie fox is the weirdest one yet how does your waist get that small like wtf,-0.4939,Negative,-0.375,Negative,0.4309960901737213,Positive
The last lady looked like a Little Nightmares chef,0.3612,Positive,-0.09375,Negative,-0.2215946614742279,Negative
"What about when plastic becomes illegal, they’ll take back all the plastic in them",-0.5574,Negative,-0.25,Negative,-0.5677934288978577,Negative
The ken doll guy is just a pay to win,0.5267,Positive,0.8,Positive,0.5064641237258911,Positive
"The husband cheated, there could’ve been a penalty clause in the settlement that gave her that much money. Also. The husband don’t need that money either.

Remember when the rich were patrons of the art and took care of their communities? Bring back the Medicis.",0.128,Positive,0.1916666666666666,Positive,-0.6483845710754395,Negative
Both of the brother passed away recently😓,-0.4215,Negative,0.0,Neutral,-0.3165959417819977,Negative
RIP Bogdanoffs,0.0,Neutral,0.0,Neutral,-0.4036425948143005,Negative
These two are gay for each other no cap.,-0.296,Negative,0.1458333333333333,Positive,-0.5883029103279114,Negative
Your dog is absolutely adorable,0.5413,Positive,0.5,Positive,0.8785921335220337,Positive
Wilderstain is a super down to earth lady! She is super nice!,0.9039,Positive,0.3055555555555555,Positive,0.7642331123352051,Positive
Both I wanna look good and be strong,0.7351,Positive,0.5666666666666667,Positive,0.4890631139278412,Positive
"the argument of ""its a shortcut,he didn't put time and effort in""

money????????????(unless his parents gave it to him) but money are worked,made through time and effort,if it's his money then its his effort.",-0.4039,Negative,0.0,Neutral,0.3691716194152832,Positive
"saying that alimony is a scam is assuming that the marriage didn't benefit the breadwinner in any way.

It's like saying ""Marzia has nothing to do with my youtube channel, she didn't contribute to our wealth together, she doesn't deserve any alimony if we divorce."" Even though she literally is behind the camera sometimes.",-0.123,Negative,-0.4,Negative,-0.4530647397041321,Negative
Just accept how u r born ppl ah this makes me feel weird and sick 🤢 this is so sad,-0.75,Negative,-0.5714285714285715,Negative,-0.8317903876304626,Negative
9:43 bruhh why didn't the world end before this was even a thing! Bruhh wtf did I just witnessed?😂😒🤔,-0.2942,Negative,-0.5,Negative,-0.4480930864810943,Negative
bro wtf,-0.5859,Negative,-0.5,Negative,0.2665678560733795,Neutral
2:40 - CLICK HERE for BeatBox! 😆,0.4199,Positive,0.0,Neutral,-0.2691432237625122,Negative
loved the discussion,0.5994,Positive,0.7,Positive,0.4841161668300628,Positive
"bet seriusly, YOU wanted it, YOU paid them for to do it. ITS THER JOB!! you cant say that they are the problem. if   YOU wanted it, its the beauti standard that make ppl go too far its NOT THE DOCTORS. They are freking just doibg there jobs YOU have the responsibility to stop. NOT THEM. Its your valut and NOT the DOCTORS",-0.6688,Negative,0.05,Positive,-0.5334950685501099,Negative
"Wtf is this guy on my pewdiepie videos????. When he is not making a failed joke, he is laughing in a previous one",0.6442,Positive,-0.3888888888888889,Negative,-0.5613678693771362,Negative
nice video mate,0.4215,Positive,0.6,Positive,0.4559553861618042,Positive
I think it's safe to say that life is a lot better when Pewds is uploading.,0.7003,Positive,0.5,Positive,0.4506366848945617,Positive
edgar looks old ;(,0.0,Neutral,0.1,Positive,0.32676962018013,Neutral
absolute banger,0.0,Neutral,0.2,Positive,-0.7219011783599854,Negative
divorce was the first subject I saw pew sweat thinking about.,0.0,Neutral,0.0416666666666666,Positive,0.2480261027812957,Neutral
At the start he sounded like jimbo’s friend Ned from South Park,0.6908,Positive,0.0,Neutral,0.2889746129512787,Neutral
I feel like Ken’s “Animorph” comment went very unnoticed but prob bc Felix didn’t grow up with it 🤣,0.7227,Positive,-0.26,Negative,0.3479647636413574,Positive
NO YOU!,-0.3595,Negative,0.0,Neutral,-0.6699199080467224,Negative
do solo commentary i don't like it when your doing vids with other people,-0.2755,Negative,-0.125,Negative,-0.4139773547649383,Negative
Doctors love this stuff....$$$$,0.6369,Positive,0.5,Positive,0.8341413736343384,Positive
What’s sad is that a lot of these people are beautiful without surgery but society has convinced us that if we don’t look a certain way we can’t live up to the Beauty standards.,0.9153,Positive,0.1751623376623376,Positive,0.4020035564899444,Positive
Please do reactions without Ken,0.3182,Positive,0.0,Neutral,0.2991099655628204,Neutral
ngl i don't care what other people do with their bodies as long they aren't hurting anyone. if they know the risks and want to do it idgaf,-0.2892,Negative,-0.0875,Negative,0.2944489419460296,Neutral
cosmetic surgeries shouldnt be legal. (this does not include reconstructive surgeries or quality of life improving surgeries),0.3464,Positive,0.2,Positive,0.3160907924175262,Neutral
0:04 zrób  mi louda,0.0,Neutral,0.0,Neutral,-0.6072512865066528,Negative
I wish you would do these videos alone,0.1779,Positive,0.0,Neutral,0.2212137281894683,Neutral
Your so super because you have so many subscribers!,0.6689,Positive,0.4791666666666666,Positive,0.8901091814041138,Positive
"to drunk to ,watch something more substansian",-0.079,Negative,0.0,Neutral,-0.3694075047969818,Negative
"Unpopular opinion: 
Surgeons that keep operating on people who are addicted to surgery are as bad or worse than doctors who keep prescribing narcotics to drug addicts.",-0.765,Negative,-0.5,Negative,-0.7111408710479736,Negative
"1:17 I'm not gay, but I must protect pewds smile",0.7684,Positive,0.0458333333333333,Positive,0.2485296130180359,Neutral
Get rid of those dead headphones ffs man.,-0.8442,Negative,-0.2,Negative,-0.5316117405891418,Negative
bogdanoff brothers died just days ago ☹️,-0.7184,Negative,0.0,Neutral,-0.4454502165317535,Negative
"Cheating is good sometimes, been cheating on my diet for years now xD",-0.128,Negative,0.7,Positive,0.2423091232776641,Neutral
"barfed at that third one, bruh",0.0,Neutral,0.0,Neutral,-0.4773486256599426,Negative
The last one is straight out of little Nightmare :D,0.6863,Positive,0.253125,Positive,0.2446300536394119,Neutral
Jai carryminati,0.0,Neutral,0.0,Neutral,0.2382180094718933,Neutral
spends $120000 to look uglier... makes no sense,-0.6597,Negative,0.0,Neutral,-0.6271386742591858,Negative
i thought i was having a stroke at the intro,0.0,Neutral,0.0,Neutral,-0.3459421396255493,Negative
8:42,0.0,Neutral,0.0,Neutral,-0.2161799818277359,Negative
When the Ken-doll man is done he's gonna look like frieza,0.3612,Positive,0.0,Neutral,-0.3249710500240326,Negative
its because they use ti for plates now ...not magnetic and wont go off in a metal detector,0.0,Neutral,0.0,Neutral,-0.3767276704311371,Negative
Did you guys already prayed to you god Zyzz? Do it now if you didn't!!?,0.4667,Positive,0.0,Neutral,-0.4325739443302154,Negative
Maybe the doctors take on what stupid people say cause they want the money 🙄🤔,-0.4767,Negative,-0.7999999999999999,Negative,-0.4953503608703613,Negative
Glad they pointed out how fucked it is that the doctors are preying on mentally ill people,-0.6369,Negative,-0.1999999999999999,Negative,-0.4372250139713287,Negative
Alimony has NOTHING to do with the child it’s so the wife can “live the life they have become accustomed too” smh it’s a scam and it’s stupid so pretty much any woman can marry a rich guy and then leave them and divorce them and just cuz he is rich she can get paid even after the divorce,0.4051,Positive,0.0893939393939394,Positive,-0.5911481976509094,Negative
Best ad read 10/10,0.6369,Positive,1.0,Positive,0.9492152333259584,Positive
8:02,0.0,Neutral,0.0,Neutral,-0.2591862082481384,Negative
Rip bogdanoff twins 😔,0.0772,Positive,0.0,Neutral,0.2576481103897095,Neutral
"I like how he explains benefits of using VPN to Edgar,
Hope Edgar starts using it soon.",0.7906,Positive,0.0,Neutral,0.6089605689048767,Positive
omg ken doll guy reminds me of spongebob with anchor arms 😭😭😭,-0.8519,Negative,0.0,Neutral,0.4537528157234192,Positive
this ticked me off so much. there's nothing the doctor can do. if they refuse the patient can complain and then the doctor cant respond because of hippa boop bop bang bye bye carreer,-0.7579,Negative,0.2,Positive,-0.6607841849327087,Negative
"Alimony isn't for the kids. It's for the person being divorced. It's like suing someone for emotional distress leading up to the divorce. So like, suing someone for hurting you so badly by cheating on you. And tbh if this woman turned around and got a bunch of plastic surgery in response to being divorced, I figure this guy really did cause her a lot of emotionak distress. I just wish she got therapy and better relationships instead of plastic surgery to fix the hole in her heart, instwad of the wrinkles in her face.

Child support is for the kids. That's what it's called. And it probably dtops being due when all the children turn 18 years old.",-0.3386,Negative,-0.0041666666666666,Negative,-0.4159033298492431,Negative
why wasnt oli london there,0.0,Neutral,0.0,Neutral,-0.4066405892372131,Negative
Pretty sure both of the Bogdanoff twins just died. Rest easy weirdies.,0.4215,Positive,0.3944444444444444,Positive,0.392895758152008,Positive
Holy eff....the camera work. Must have been a new years resolution,0.0,Neutral,0.1363636363636363,Positive,0.6127651333808899,Positive
The two twin men died a few weeks after this video,-0.5574,Negative,-0.2,Negative,-0.5040952563285828,Negative
Türkiye en büyük,0.0,Neutral,0.0,Neutral,0.7318949103355408,Positive
This is why I do not ever want anyone to do plastic surgery because of all these disasters likely happening.,-0.5889,Negative,0.0,Neutral,-0.4913713932037353,Negative
Pixee Fox has the body of a One Piece female character.,0.0,Neutral,0.0,Neutral,-0.3370260596275329,Negative
NEM RAPS DOIN THAT VOICE OVER 😩🙌🏽,-0.2732,Negative,0.0,Neutral,-0.5319819450378418,Negative
To be a real Ken doll he's gotta get something removed not implanted.,0.0,Neutral,0.2,Positive,-0.3065778017044067,Negative
TO EASY,0.4404,Positive,0.4333333333333333,Positive,0.2776204645633697,Neutral
"Aging and getting old is part of life, and it will come to all of us. I severely don’t understand why ppl is so afraid to something so natural in our lifetime.",0.0622,Positive,-0.1333333333333333,Negative,0.5911930203437805,Positive
"Well, the Bogdanoff brothers unfortunately both died a few days ago from Covid :/",-0.743,Negative,-0.3166666666666666,Negative,-0.3379037976264953,Negative
These are going to be the weirdest looking old people in a few decades. Not talking about Ken and Felix....but them too.,-0.2263,Negative,-0.05,Negative,0.3067069351673126,Neutral
"Apparently both of the Bogdanoff Twins died from Corona, both unvaccinated.",-0.5574,Negative,0.05,Positive,-0.4927591681480407,Negative
I usually skip promotions but couldn't this time lol that puppy was way too cute! 😍,0.7426,Positive,0.3916666666666666,Positive,-0.3996180295944214,Negative
You two keep me going 💯❤️🥺,0.0,Neutral,0.0,Neutral,0.3359509110450744,Positive
Wait wait wait… did you make a Power Pete reference with the “caveman ooga booga “ 😂😂,0.7003,Positive,0.0,Neutral,-0.4016544222831726,Negative
The doctors just want to get paid 💀☠️,0.0772,Positive,0.0,Neutral,-0.256056547164917,Negative
To the people who dislike pewdiepie s vids…. How what can you find wrong with them,-0.6908,Negative,-0.5,Negative,0.3830767571926117,Positive
Also plastic surgery is such a trend at the minute. Young people in their late teens early 20s are wanting Botox and filler for extremely fine lines which could be fixed over time with hydration. It’s devastating especially now we are at a time where some people disclose how they’ve had work done but most don’t so younger people are taking it as if they haven’t disclosed it they must be all natural. Same as filters etc younger people aren’t bringing in photos of celebrities to their surgeon anymore they are bringing filtered versions of themselves. I could talk for hours about this subject and don’t even get me started on the body. I’m all for people having cosmetic surgery but there needs to be more education on the subject rather than just before and afters and maybe some info on the procedure…people are forgetting it’s a medical procedure that heavily ties in with mental well-being. It shouldn’t be treat like some taboo subject we can’t talk about but it also shouldn’t be something we can go get done on our lunch break in some place where you can also get eyelash extensions,0.8379,Positive,-0.0141666666666666,Negative,-0.3574176132678985,Negative
And that's my friends is why such thing is Haram for us unless it's Necessary to fix something in your body that has been damaged by an accident otherwise it's a sin to change your body shape for fun or a desire that leads to a horrible mistake.,-0.7506,Negative,-0.175,Negative,-0.7505977153778076,Negative
why did i expect oli london,0.0,Neutral,0.0,Neutral,-0.2735217213630676,Negative
Happy New Years,0.5719,Positive,0.4681818181818182,Positive,0.6355273723602295,Positive
Is like play Tetris with your organs...,0.5994,Positive,0.0,Neutral,0.3693279027938843,Positive
I think Ken actually brought up a really good point about encouraging people who want extensive plastic surgery to seek help from a psychiatrist first,0.8622,Positive,0.2375,Positive,0.4711259603500366,Positive
"Why just not jump into giant wax pot, the best way to become plastic forever! The best way to save tons of milions of dolars and time wasted on plastic surgeries!",0.8745,Positive,0.4375,Positive,0.5724323391914368,Positive
This is just a video of Felix being freaked out by ugly people. lol,-0.4019,Negative,0.05,Positive,-0.4826384782791137,Negative
at least her milk is pretty Gaintttttt,0.4939,Positive,-0.0249999999999999,Negative,0.3965581655502319,Positive
the bogdanoff brothers look like the guard at the start of morrowind,0.3612,Positive,0.0,Neutral,0.354865700006485,Positive
…..all I’m paying attention to is Kens right pocket….I WANT TO FIX IT jnsiwhdiyaji,0.2577,Positive,0.2857142857142857,Positive,0.2762465476989746,Neutral
"watching this video made me feel sick to my skin. idk how to explain the feeling, but I just feel a sense of disgust and my body shivering whenever i think about these plastic surgeries",-0.8151,Negative,-0.7142857142857143,Negative,-0.4783910512924194,Negative
you are pewdiful!,0.0,Neutral,0.0,Neutral,0.3979889154434204,Positive
That's horrible,-0.5423,Negative,-1.0,Negative,-0.7950592637062073,Negative
Wheres oli london lmao,0.5994,Positive,0.6,Positive,-0.2735044658184051,Negative
Cinnamon Toast Ken doll,0.0,Neutral,0.0,Neutral,0.2943456768989563,Neutral
"10:06
Note to self",0.0,Neutral,0.0,Neutral,-0.2920991778373718,Negative
real men use cat ear headphones,0.0,Neutral,0.2,Positive,0.3732396066188812,Positive
"Nobody's gonna talk about the sponser 
It's so cute the way he did it with edgar 
It's the first time in my life i didn't skipped the sponer 
The hell i even went to watch it again",-0.1861,Negative,0.375,Positive,0.67542964220047,Positive
"I hate it 
I can never enjoy the journey i always pays attention to the end goal 
It's not like I wanted to do excercise coz i like doing excercise 
I do excercise coz i want that stamina thT figure that strength  
I just can't enjoy the journey and that's why I always fail I HATEE IT HELLPPPP",-0.7481,Negative,-0.275,Negative,-0.6613830924034119,Negative
Plastic surgery just ruins you're face and everything.  *Facepalm*,-0.4404,Negative,-0.15,Negative,-0.6394980549812317,Negative
dang pewd's voice in the beginning sounds like the throat singing from Dune,0.3612,Positive,0.0,Neutral,-0.2953523099422455,Negative
Ken could be like a caricature voice for American character,0.3612,Positive,0.0,Neutral,0.3177724778652191,Neutral
Olly London be like you dare challenge me,0.4215,Positive,0.0,Neutral,0.4729769825935364,Positive
I saw that 2nd guy Justin in a club in Amsterdam once lmao,0.5994,Positive,0.3,Positive,0.2232336997985839,Neutral
"You guys missed the point: the guy cheated on her. And he can afford the 100million. If he didn't want to pay, then don't cheated",-0.4067,Negative,0.0,Neutral,0.2302613258361816,Neutral
doctor = bully,-0.4939,Negative,0.0,Neutral,-0.3953966200351715,Negative
Lesson learned: always have proffesionals who won't neglect people's health.,0.357,Positive,0.0,Neutral,0.4180103242397308,Positive
4:40 everyone is so mean 2 me 💔,0.2732,Positive,-0.3125,Negative,-0.4206481873989105,Negative
This is proof we shouldn’t mess with God’s creation,-0.1027,Negative,-0.175,Negative,0.6456823348999023,Positive
That intro lmao,0.5994,Positive,0.6,Positive,0.251777708530426,Neutral
I really don't click with these ken collab videos,0.0,Neutral,0.2,Positive,-0.5785817503929138,Negative
"The sad thing is that there are a lot, if not the majority, of US doctors will refuse to operate until they're cleared by a therapist. Unfortunately, you can always find doctor who isn't interested in anything but money. If you can't find a US doctor, they'll go over seas. Then if they're desperate enough they'll either do it themselves or go to a back alley place. That's what the issues was from the last person.",-0.7737,Negative,-0.1928571428571428,Negative,-0.4039926826953888,Negative
I like them natural,0.6124,Positive,0.1,Positive,0.4673165678977966,Positive
Edger melts my heart I love his scrunch face 😘,0.9042,Positive,0.5,Positive,0.6904901266098022,Positive
I had jaw surgery because of a tumor,-0.3818,Negative,0.0,Neutral,-0.314801424741745,Negative
You wanna know how i got these scars?,0.0,Neutral,0.0,Neutral,-0.3198793530464172,Negative
💕💕💕,0.9313,Positive,0.0,Neutral,0.3085779249668121,Neutral
I’m surprised Oli London wasn’t on the top 9.,0.4019,Positive,0.3,Positive,0.3609485328197479,Positive
"They tried to make it private so I downloaded it, you tried try again",0.0,Neutral,0.0,Neutral,-0.5869028568267822,Negative
"I became a personal trainer after 17 years of dancing and having to stop suddenly. Initially, I was freaked out about the change in my physique so I started going to the gym to look better. It became addictive because I began to feel better. So when Ken asked Felix if he worked out for looks or for strength, his response was pretty much what I saw with most of my clients and myself.

I also found that I really wanted plastic surgery until I started feeling better mentally and physically.",0.9042,Positive,0.2125,Positive,0.4072820246219635,Positive
Ken is like the nice and entertaining uncle in his videos :),0.8807,Positive,0.5333333333333333,Positive,0.4628999829292297,Positive
"I had breast reduction, due to severe back and neck pain. Something I learned is that if you are doing it for anyone else at all Or it will give you some extra worth, it's the wrong decision because you will never be everyone's cup of tea. There's no harm in getting a little work done, just like whitening your teeth or doing your hair. But the line is very thin.",-0.2204,Negative,-0.1475,Negative,0.429498940706253,Positive
"Lol Ken I had jaw surgery too, And I have forgotten about it usually until I get an x-ray done and the doctor is like ""what's in your mouth"" lol. And I was told that apparently the screws are titanium, not metal. They stopped using metal mostly for quite a while",0.7065,Positive,0.38,Positive,-0.4132381081581116,Negative
My ex had a bike wreck 10yrs ago & they had to use plates to put in his face back together...magnets don't 'stick' to his face but they do cause the muscles around the plates to twitch,-0.2382,Negative,0.0,Neutral,0.3066078424453735,Neutral
"Its funny how he would rather spend 250,000 on implants instead of working out or even taking steroids.",0.4404,Positive,0.25,Positive,0.4061191082000732,Positive
I would argue that genital mutilation is also harmful to mentally ill patients… but ya know,-0.3818,Negative,-0.5,Negative,0.3680834770202636,Positive
04:46 😭😭😭,-0.8519,Negative,0.0,Neutral,-0.2737020254135132,Negative
Это было ошибкой садиться есть и смотреть это видео одновременно...,-0.34,Negative,-0.0777777777777777,Negative,-0.4220214486122131,Negative
Body dismorphia in all its glory,0.5423,Positive,0.0,Neutral,0.669401228427887,Positive
I think that plastic surgery on people who suffer with facial complications due to accidents or birth defects are cool. But doing it just to look like another generic idol face is just pitiful and disgraceful.,-0.631,Negative,0.0562499999999999,Positive,-0.4478314816951751,Negative
⭐⭐⭐⭐(4/10),0.0,Neutral,0.0,Neutral,0.2956233918666839,Neutral
