Comment,Vader score,Vader label,TextBlob score,TextBlob label,BERT score,BERT label
JIHYO ma petite princesse RAIPONCE !!!! cela lui va à ravir 💃🍓♥️👸tes parents doivent être fière de toi JIHYO 😄 continue toi et tes petites sirène TWICE à me faire rêver. je vous adore !!!! ♥️♥️♥️♥️♥️♥️♥️♥️♥️🍓🍓🍓🍓🍓🍓🍓🍓🍓💃💃💃💃💃💃💃💃💃👸😺🌹,0.996,Positive,0.28868408203125,Positive,0.7755288481712341,Positive
Are you watching the Dead Poets' Society?,-0.6486,Negative,-0.2,Negative,-0.2629245817661285,Negative
JIHYO BEST GIRL,0.6369,Positive,1.0,Positive,0.7691822052001953,Positive
"kenapa paling best karena nunjukin kesusahan perjalanan 7 jam ke houston, jadinya lebih relatable, vlognya jihyo untuk saat ini. yang lain belum upload soalnya.",0.4215,Positive,0.75,Positive,0.3591305315494537,Positive
best twice tour vlog.,0.6369,Positive,1.0,Positive,0.5763316750526428,Positive
So pretty 🥰,0.9016,Positive,0.25,Positive,0.4520043134689331,Positive
You know it feels peacefull looking at you,0.0,Neutral,0.0,Neutral,0.2774535715579986,Neutral
It's so fun to watch twice's vlog,0.5563,Positive,0.3,Positive,0.5856802463531494,Positive
Jihyo te amo mucho,0.6369,Positive,0.35,Positive,0.5696342587471008,Positive
"志效
美女一枚",0.5859,Positive,0.0,Neutral,0.2936255633831024,Neutral
Jihyo saranghaee,0.0,Neutral,0.0,Neutral,0.2414897978305816,Neutral
😍🥰,0.8834,Positive,0.0,Neutral,0.3085779249668121,Neutral
지효 브이로그가 너무 재밌어서 많이 올려주셨으면 좋겠어요!😚❤,0.94,Positive,0.3,Positive,0.3370530903339386,Positive
"She trained for ten years, never gave up, and now she leads one of the biggest girl groups in global history.",0.0,Neutral,0.0,Neutral,0.7693902254104614,Positive
Jihyo ❤️❤️❤️❤️❤️❤️,0.0,Neutral,0.0,Neutral,0.2691663205623626,Neutral
"jihyo, se te extrañaba",-0.296,Negative,0.0,Neutral,-0.4183307886123657,Negative
"可愛い可愛い可愛い可愛い可愛い可愛い
天使天使天使天使天使天使天使天使天使
もーーーーーージヒョちゃんになりたいー😭😭😭",0.8402,Positive,0.5,Positive,0.504218339920044,Positive
11:53 wow.,0.5859,Positive,0.1,Positive,0.3774003386497497,Positive
뉴욕편 없다고  뉴욕원스들 엄청 삐졌답니다.   단체편에서라도 나왔으면 좋겠습니다 😂,0.1298,Positive,0.0893939393939394,Positive,-0.3656492829322815,Negative
Laloves Jihyo ❤,0.6369,Positive,0.0,Neutral,0.2770316004753113,Neutral
Jihyo ahhhhhh,0.0,Neutral,0.0,Neutral,0.2583613693714142,Neutral
what hotel did they stay at in LA? that view is insane….,0.0,Neutral,0.0,Neutral,-0.6544047594070435,Negative
"We really enjoyed it,and the next is chaeyoung♥️",0.8313,Positive,0.25,Positive,0.4662314653396606,Positive
🥰,0.8074,Positive,0.0,Neutral,0.3085779249668121,Neutral
Her CUT CUT is so CUTE.,-0.163,Negative,0.5,Positive,0.6071963310241699,Positive
this vlog is just so fun! keep it up Jihyo! 이 브이로그 너무 재미있습니다. 실제로 최고. 너무 좋아서 보는 내내 웃게 만들었어요. 앞으로 더 많은 브이로그! jihyo 감사합니다 잘 되길 바랍니다. 당신을 사랑합니다,0.9848,Positive,0.4193749999999999,Positive,0.929180383682251,Positive
JIHYO TE AMO,0.6369,Positive,0.5,Positive,0.3489617705345154,Positive
힘들텐데..항상 지효가 너무이쁘다..,0.5742,Positive,-0.0208333333333333,Negative,0.5074101090431213,Positive
Ella es realmente h3rmosa 😊😍 JIHYO,0.9256,Positive,0.85,Positive,-0.310740977525711,Negative
Siii👌🏻,0.7297,Positive,0.0,Neutral,0.3085779249668121,Neutral
리더라서 책임지고 텐션 딱 이끌어주고 멤버들 챙기고 그런게 잘 보인다!! 우리 죠 ♡,0.3578,Positive,0.0,Neutral,0.714989960193634,Positive
29:58 is so perfectly timed thank you editors 🙇🫂,0.8454,Positive,1.0,Positive,0.8438575267791748,Positive
I'm guessing chaeyoung will be the next one! 🤞💖,0.7712,Positive,0.0,Neutral,0.2827661037445068,Neutral
I can’t believe that you’re the same age as me. SO BEAUTIFUL!!!! 😍😍❤️❤️,0.9514,Positive,0.5,Positive,0.9289381504058838,Positive
"i think the next vlog is chaeyoungs, i really enjoyed this longer one. i love you jihyo😭",0.6901,Positive,0.3333333333333333,Positive,0.7312150001525879,Positive
"Jihyo ah,Marry me please !!",0.4374,Positive,0.0,Neutral,0.5683440566062927,Positive
Wonder how many Jihyo memes people got you of this video.,0.0,Neutral,0.5,Positive,-0.5283137559890747,Negative
"so pretty, 사랑해요!!🥺❤",0.9292,Positive,0.375,Positive,0.7875351905822754,Positive
"the transition at 23:36 shows that she really has been watching vlogs, so cute when she picks up the camera as it's already rolling! Jihyo always goes beyond what I expect. Probably my favorite idol ever.",0.7997,Positive,0.4416666666666666,Positive,0.7847488522529602,Positive
"te amo Jihyoo, amé el vlog 💕💕",0.9565,Positive,0.6,Positive,0.3887788355350494,Positive
"13:14 Jihyo playing with her hair os so pretty and hot at the same time. And I like how she smiles through out the whole video, except for her mission of course.
23:14 -23:32 Jihyo with her funny but pretty accent speaking English ❤ 
She is pretty with ou without make out. I can't with her!",0.9732,Positive,0.1890625,Positive,-0.3814533650875091,Negative
💛💛,0.8555,Positive,0.0,Neutral,0.3085779249668121,Neutral
13:49 total girlfriend material.,0.0,Neutral,0.0,Neutral,-0.3160653710365295,Negative
Where is that orange shirt from on 13:51 I saw it on jeongyeon too and it looks so comfy I need it😩,-0.2732,Negative,0.0,Neutral,0.5617747902870178,Positive
"The one time I flew Korean Air, in coach mind you, and they brought over the bibimbap, lawd. It was amazing. That paste was godlike. Bless this airline.",0.765,Positive,0.6000000000000001,Positive,-0.6913194060325623,Negative
"i've literally only seen her sing and talk in interviews before, never casually like this. mainly bc i dont follow twice that closely. but the way she talks is so soothing and calming, i love her voice.",0.9315,Positive,0.2291666666666666,Positive,0.5140261054039001,Positive
"0:53
12:17 cool 😎
23:30",0.6486,Positive,0.35,Positive,0.2442172914743423,Neutral
I love you jihyo 💜❤️,0.8555,Positive,0.5,Positive,0.8195165991783142,Positive
The vlog is fun but watching it during fasting month is quite challenging,0.5407,Positive,0.4,Positive,0.5086294412612915,Positive
ジヒョちゃんの笑顔が本当にきらっきらで素敵🥰💗　onceのためにたくさん移動してくれてありがとう🥹,0.9782,Positive,0.7333333333333334,Positive,0.3202371001243591,Neutral
Is jihyo still with kang daniel?,0.0,Neutral,0.0,Neutral,0.315545916557312,Neutral
i love u mahal ko,0.8555,Positive,0.5,Positive,0.7220916748046875,Positive
지효 예뻐❤️,0.4939,Positive,0.0,Neutral,0.3923686444759369,Positive
25:43,0.0,Neutral,0.0,Neutral,0.2227981984615326,Neutral
"jihyo i cant stop staring at you, you're so beautiful 😭😫",0.157,Positive,0.85,Positive,0.7299473881721497,Positive
LOL. Nayeon was definitely not helping with her missions. The way Jihyo was side glancing was hilarious.,0.7932,Positive,0.4333333333333333,Positive,-0.439301073551178,Negative
I don`t have nothing to say about this lovely video.,0.6705,Positive,0.5,Positive,0.7008478045463562,Positive
"O vlog da Jihyo é mais gente como a gente, mostrando os perrengues kkkkjj AMOOOOO <3",0.6887,Positive,0.75,Positive,0.2659825086593628,Neutral
I love you so much 😭💖💖,0.9279,Positive,0.35,Positive,0.8957449793815613,Positive
❤️❤️❤️,0.0,Neutral,0.0,Neutral,0.3085779249668121,Neutral
This has been my personal favourite vlog so far. They all have been great tho :),0.7964,Positive,0.35,Positive,0.8501281142234802,Positive
impossível não rir com a sana ou a nayeon por perto 😂😂,0.4359,Positive,-0.1833333333333333,Negative,-0.5332438945770264,Negative
I wanted all the food she ate on tour! Does anyone know where they ate in LA bc it looked freaking delicious?,0.2942,Positive,1.0,Positive,-0.3385061919689178,Negative
Jihyo love u 😘,0.7906,Positive,0.5,Positive,0.739215075969696,Positive
I know this vlog was like almost 31 minutes long but if flew by so fast. Definitely one of my faves so far,0.6925,Positive,0.0625,Positive,0.329103022813797,Neutral
U are so beautiful jihyo,0.7177,Positive,0.85,Positive,0.7887271046638489,Positive
Jihyo t amo <3,0.4404,Positive,1.0,Positive,0.3188666403293609,Neutral
why can't jype let you go outside? T.T,0.0,Neutral,0.0,Neutral,-0.5022928714752197,Negative
thank you so much for the 30 minutes vlog 🥺,0.3612,Positive,0.2,Positive,0.7140008807182312,Positive
Subtitle Indonesia????,0.0,Neutral,0.0,Neutral,-0.4609718322753906,Negative
Es tan bella aun sin maquillaje!!!,0.7825,Positive,1.0,Positive,0.7383910417556763,Positive
Me gustaria tener una hermana como jihyo ^-^,0.6124,Positive,0.0,Neutral,0.3455704748630523,Positive
traduz pra portugues do brasil ai pfv,0.0772,Positive,0.0,Neutral,0.3191269040107727,Neutral
夕食時ずっと眠そうなジヒョ可愛い,0.0,Neutral,0.0,Neutral,0.4183647334575653,Positive
"jihyo should be a youtuber, her vlogs are so cute <3",0.7932,Positive,0.75,Positive,0.3103375732898712,Neutral
🌹🌹🌹🤍,0.0,Neutral,0.0,Neutral,0.3085779249668121,Neutral
🌹🌹🌹🤍,0.0,Neutral,0.0,Neutral,0.3085779249668121,Neutral
Jihyo ♡♡♡,0.0,Neutral,0.0,Neutral,0.5867346525192261,Positive
"es impresionante ver todo lo que tuvieron que pasar para poder llegar a tiempo al concierto uu, no puedo esperar para ver el blog de chae uwu",0.5859,Positive,0.6000000000000001,Positive,0.6900544166564941,Positive
Pacar gua :),0.4588,Positive,0.5,Positive,0.3462148308753967,Positive
jihyo ako na lang tatawa para sayo 🤣🤣🤣,0.9217,Positive,0.3,Positive,0.2746360003948211,Neutral
Queen ♥️,0.6369,Positive,0.0,Neutral,0.6640402674674988,Positive
24:54 Silly members trying to compete in sound with the mic 😅,0.3818,Positive,-0.0499999999999999,Negative,-0.2696851789951324,Negative
"I feel like twice is ending, and this world tour is actually a farewell. My girls' contracts expire this year.",0.3612,Positive,0.0,Neutral,0.549587070941925,Positive
💜💜,0.8555,Positive,0.0,Neutral,0.3085779249668121,Neutral
"7:45 째용이 너무 귀엽자나!!!
시차적응 잘 못해서 피곤하고 천근만근인데 공연을 해내다니 대단하고 프로페셔널하당.. 나였음 바로 반차나 연차 갈겼을건데ㅠㅠ존경스럽고 또 하나 배우고 가는 기분이예요~",0.8635,Positive,0.1556994047619047,Positive,-0.4446732997894287,Negative
I love twice,0.6369,Positive,0.5,Positive,0.7702556848526001,Positive
Hola Jihyo eres hermosaa!!💕,0.8684,Positive,0.0,Neutral,0.6901545524597168,Positive
I LOVE YOU,0.6369,Positive,0.5,Positive,0.8546807765960693,Positive
Jihyo loves creating vlogs and I love it! The more time we get to see Twice<3,0.8858,Positive,0.5625,Positive,0.8500160574913025,Positive
"Jihyo really bloomed😍. Btw, she and Jeongyeon have the same orange shirt.. 😁",0.7414,Positive,0.1,Positive,0.2793444097042084,Neutral
الفلوق عبارة عن اكل 🫂🫶🏻🫂🫶🏻,0.0,Neutral,0.0,Neutral,-0.275241494178772,Negative
SHES WATCHING ALL OF US ARE DEADDD,-0.6486,Negative,-0.2,Negative,-0.6422008872032166,Negative
Linda la Jihyo  😍,0.7184,Positive,0.5,Positive,-0.2228737771511078,Negative
I’m enjoying every minute of this vlog! She’s so cool and confident and an all around professional.,0.8792,Positive,0.39375,Positive,0.8616521954536438,Positive
Linda é Maravilhosa,0.7845,Positive,0.625,Positive,0.8215005397796631,Positive
Wow jihyo bare face is just as pretty as makeup on,0.7906,Positive,0.1333333333333333,Positive,0.6490528583526611,Positive
"TE AMO, BEBÉ LINDA. ERES LA MEJOR LÍDER QUE TWICE PUEDE TENER. Te amo, te amo, te amo ♥️💗",0.9901,Positive,0.5833333333333334,Positive,0.9314612746238708,Positive
아름다운 당신을 사랑합니다,0.8442,Positive,0.675,Positive,0.8504594564437866,Positive
we love you pretty you are the best leader ♥️,0.9501,Positive,0.5833333333333334,Positive,0.8817853927612305,Positive
"I love her smile so much 🥺🥺 it just makes me so happy and warms my heart 😭❤️❤️ 
Jihyo is such a great vlogger 🤌🏻 always making sure she  gives us the best content",0.9788,Positive,0.5125,Positive,0.8926030993461609,Positive
Jihyo bonita 😢,-0.4767,Negative,0.0,Neutral,0.3356818556785583,Positive
"She also reminds me of Huller Dorothy, she looks exactly like her.",0.3612,Positive,0.25,Positive,0.5341055393218994,Positive
I love it,0.6369,Positive,0.5,Positive,0.8333382606506348,Positive
사랑해 지효♥️🌚,0.8555,Positive,0.5,Positive,0.713543176651001,Positive
I love her so much,0.6369,Positive,0.35,Positive,0.8442870378494263,Positive
i love you jihyo <3,0.7964,Positive,0.75,Positive,0.758608877658844,Positive
"6:02 , 23:19 Jeonghyo",0.0,Neutral,0.0,Neutral,0.2259508520364761,Neutral
PARK JIHYO. LEADER. VOCALIST. DANCER. VISUAL. RAPPER. ACTRESS. LYRICIST. COMPOSER. PRODUCER. MODEL. FASHION ICON. COMEDIAN. PHOTOGRAPHER. VLOGGER. THERE IS REALLY NOTHING THAT SHE CAN'T DO.,0.3818,Positive,0.1,Positive,-0.3629298508167267,Negative
지효 귀염,0.3612,Positive,0.0,Neutral,0.2548098862171173,Neutral
i can say that Jihyo TW-log is the most entertaining and fun to watch episode so far. Not because she s my bias but because every content of her videos are so full like everything she has done is so adorable.,0.9263,Positive,0.375,Positive,0.6752542853355408,Positive
NECESITO QUE JIHYO HAGA MAS VLOG 🥺❤️,0.0,Neutral,0.5,Positive,0.3916786313056946,Positive
Me encantó tu vlog Jihyo ❤️❤️,0.5994,Positive,0.7,Positive,0.7841997146606445,Positive
"One of my fav vlog, jihyo did so well!",0.7213,Positive,0.0,Neutral,0.5584707260131836,Positive
Love you beautiful Jihyo 💕💕,0.9565,Positive,0.675,Positive,0.8457018733024597,Positive
Cantknya mbak nggak kyk org korea,-0.6435,Negative,0.85,Positive,-0.2722400426864624,Negative
جيهيوووووووو,0.0,Neutral,0.0,Neutral,0.239533856511116,Neutral
Damn jihyo mamy u look hot in basic clothes,-0.4019,Negative,0.125,Positive,-0.3523806035518646,Negative
그녀가 브이로그를 더 했으면 좋겠어! 그녀의 것은 보기에 가장 재미있었어! 사랑스러운 지효,0.893,Positive,0.640625,Positive,0.67916339635849,Positive
Jihyo unnie uwu,0.5267,Positive,0.0,Neutral,0.2639737725257873,Neutral
That was fun Jihyo. Your the best leader!,0.8313,Positive,0.65,Positive,0.7235326170921326,Positive
"jihyo es una chica tan encantadora me encanta ver todo lo que hace, este vlog fue muy lindo y entretenido, te amo jihyo<33",0.9621,Positive,0.4416666666666666,Positive,0.8697192072868347,Positive
Cantik banget cewe aku😁😄,0.6361,Positive,0.85,Positive,0.4282919764518738,Positive
Really love jihyo’s vlog,0.6697,Positive,0.5,Positive,0.7461177110671997,Positive
I LOVEDDDDD,0.0,Neutral,0.0,Neutral,0.5426169633865356,Positive
SARANGHAE!🥰,0.8221,Positive,0.0,Neutral,0.2911175787448883,Neutral
"I love you, 나를 다시 데려가 줄 수 있니? 나는 Basty Nayeon입니다. 당신에게 춥거나 덥습니까? ✨♥💞",0.9432,Positive,0.0375,Positive,0.5979099273681641,Positive
jihyo vem pro brasil pfv,0.3182,Positive,0.0,Neutral,0.3564932942390442,Positive
TWICE I feel that Jihyo looks the brightest of all Empress boss,0.6124,Positive,0.0,Neutral,0.5829547047615051,Positive
cok seviyorum,0.6369,Positive,0.35,Positive,0.5210016965866089,Positive
💗💗💗💗💗💗,0.9866,Positive,0.0,Neutral,0.3085779249668121,Neutral
ASKIMMMMM,0.0,Neutral,0.0,Neutral,0.2527641952037811,Neutral
"If this 1 hour vlog, i still watch it!",0.0,Neutral,0.0,Neutral,0.3430498540401459,Positive
She desirve this nice day because she's our leader 💖,0.8641,Positive,0.6,Positive,0.6543208956718445,Positive
24:51 JAJAJAJJAJAJAJAJAJJAJAJAJAJAJAJ I LOVE JIHYO,0.7125,Positive,0.5,Positive,0.4772156178951263,Positive
😍😍😍,0.8402,Positive,0.0,Neutral,0.3085779249668121,Neutral
jihyoooo <3,0.4404,Positive,1.0,Positive,0.2745458781719208,Neutral
역시 한국인은 비빔밥에 김이지 ㅎ,0.0,Neutral,0.0,Neutral,-0.4832678139209747,Negative
so cute and pretty,0.7755,Positive,0.375,Positive,0.6830771565437317,Positive
She is so pretty i can't...,0.6269,Positive,0.25,Positive,-0.3487526476383209,Negative
JIHYOOOOOOO 😘 SO BEAUTIFUL ❤️,0.8916,Positive,0.85,Positive,0.834539532661438,Positive
We love you JIHYO 😘💜,0.9042,Positive,0.5,Positive,0.7819916605949402,Positive
Yeah It was sososososo much fun🥰😇😍😍💜,0.9776,Positive,0.2,Positive,-0.3680696189403534,Negative
"18:32 I already know why Nayeon came so suddenly to Jihyo's room, she thinks Sana will be there, so she wanted to sabotage Jihyo's mission, making her laugh ㅋㅋ 😂😂 I can't with this girls 🤚😭",0.7269,Positive,0.15,Positive,-0.427297294139862,Negative
진짜 최고야 우리 지효 누나 잘자요,0.8115,Positive,0.6333333333333333,Positive,0.7251012325286865,Positive
"جيهيو: جونغيون ايلافيو 
جونغيون: وش فيك انتي الحين؟",0.0,Neutral,0.0,Neutral,0.269820898771286,Neutral
I love that TukTok played on the background while she's doing makeup. It's her I'm gonna be a star song 🥰🧡🧡🧡,0.9808,Positive,0.5,Positive,0.5943421125411987,Positive
My love🥺💖,0.891,Positive,0.0,Neutral,0.5787277817726135,Positive
qute🥹,0.0,Neutral,0.0,Neutral,0.3085779249668121,Neutral
"Thank you so much, Jihyo!",0.4199,Positive,0.25,Positive,0.7956411838531494,Positive
17:36 サナちゃんの性格が出てる。周りを気にかけて、いつもと様子が違ったら必ず「どうしたの？」って気づいて声かけれるのって凄いことだと思う。本当に優しくて愛情深いよね。,0.8899,Positive,0.09,Positive,0.4845336079597473,Positive
Wow. Jihyo's bare face. Just wow! You don't even need the make up girl! Still so pretty! 😍😍😍,0.9715,Positive,0.1546875,Positive,0.6363439559936523,Positive
Thank you our leadernim Hyo for giving us so much content! Also Jihyo doing her mission with Sana and Nayeon is sooo funny! 😆💗,0.9411,Positive,0.28125,Positive,0.7649708986282349,Positive
Ofcourse chaeyoung is next,0.0,Neutral,0.0,Neutral,0.3017829358577728,Neutral
Jihyo best leader<3,0.6369,Positive,1.0,Positive,0.8005968332290649,Positive
"Espectacular TW-LOG de la DIosa JIHYO como la quiero,  para verlo una y mil veces más su vlog , se ve que Jihyo usó toda la memoria, esto dura mas de 30 minutos 😅😅 amo a ITTT Más detrás de escena 😍😍😍 y descubrí que Ella es de las pocas que en realidad no requieren maquillaje y tienen un brillo natural, sin duda es la diosa. WOW, Jihyo es increíblemente hermosa. Una verdadera belleza natural con o sin maquillaje. Su personalidad y voz son una mezcla de la chica perfecta. 🥰 GRACIAS JIHYO POR HACERNOS TAN FELICES CON ESTO VLOG: Te quiero mucho jihyo 😍😘😍😘😍😘😍😘😍😘😍😘😍😘😍😘😍😘😍😘😍😘😍😘😍😘😍😘😍😘😍😘😍❤️❤️❤️❤️❤️❤️❤️❤️❤️",0.9994,Positive,0.3644444444444444,Positive,0.9211562275886536,Positive
"LIDER PARK JIHYO ,ME GUSTO TU VLOG",0.3612,Positive,0.0,Neutral,0.5663565397262573,Positive
i love her vlog :) so detailed,0.802,Positive,0.4666666666666666,Positive,0.726582407951355,Positive
너무 잘먹는다....,0.3384,Positive,0.2,Positive,-0.3902589380741119,Negative
اعض الخدوددددد,0.0,Neutral,0.0,Neutral,-0.2793303430080414,Negative
They're always stuck together,-0.25,Negative,0.0,Neutral,0.3040438592433929,Neutral
Did she use Sony's camera(ZV-1)?,0.0,Neutral,0.0,Neutral,0.2914596796035766,Neutral
Ukraine🇺🇦🇺🇦,0.0,Neutral,0.0,Neutral,0.3085779249668121,Neutral
"Jihyo and Nayeon's interactions are always funny, they're really close friends",0.7414,Positive,0.225,Positive,0.4770095646381378,Positive
黃婕議員？,0.0,Neutral,0.0,Neutral,-0.3471623361110687,Negative
I LOVEEE HERRRR,0.0,Neutral,0.0,Neutral,0.7511940598487854,Positive
Jihyo & Sana friendship is so amazing but i can't stop laughing at Jihyo reaction to Nayeon appearance in her room instead of Sana btw get well soon Sana,0.617,Positive,0.6000000000000001,Positive,0.3909108936786651,Positive
I think we all know who’s vlog is next,0.0,Neutral,0.0,Neutral,0.2938179075717926,Neutral
مقدر اتخطى جمالهااا 💗💗💗,0.9661,Positive,0.0,Neutral,0.331424355506897,Positive
"Eu não tenho dinheiro, mas pela Jihyo compraria um bar inteiro",0.0,Neutral,0.2,Positive,-0.4611704647541046,Negative
めちゃくちゃに可愛すぎる…🤦‍♀️🤦‍♀️,0.4588,Positive,0.5,Positive,0.6989631652832031,Positive
Muito amor da minha vida,0.6369,Positive,0.5,Positive,0.6918745636940002,Positive
That was very cute 🥰,0.8973,Positive,0.65,Positive,0.3176065981388092,Neutral
"It's Jihyo, LEt'S scREAM......!!!",-0.5538,Negative,0.0,Neutral,-0.3289690315723419,Negative
Wow,0.5859,Positive,0.1,Positive,0.6995608806610107,Positive
Why isn't this 1-hr long? I enjoyed watching this. I love the fact that Jihyo always includes the members in her vlogs. Best leader.,0.9136,Positive,0.4875,Positive,0.5919923186302185,Positive
Being stuck with 2 of the girls with the most infectious laughs. I feel for Jihyo.,0.3566,Positive,0.5,Positive,-0.4050213992595672,Negative
น่ารักมากกกกกกกก❤❤❤❤❤,0.9789,Positive,0.5,Positive,0.3085779249668121,Neutral
"※   🔥      유,   투  ,  브, ,    트,  *  , 터  ,     ""회, 개  ,와   , 거  , 룩 , 함   ,  사    역,    회 ,      검,  색   ...............!

※   🔥      유,   투  ,  브, , .. 엘  리야의 외  침   , 검색.................!",-0.8168,Negative,0.0,Neutral,-0.2829370498657226,Negative
จีฮโยคนสวยย,0.5994,Positive,0.85,Positive,0.3085779249668121,Neutral
"Jihyo's beauty is often underappreciated but in this vlog, she proved how pretty she is even without make up esp on that moment when she tied her hair.",0.7717,Positive,0.25,Positive,0.4095088243484497,Positive
Jihyo really enjoyed the concert ( ◜‿◝ )♡ she's so happy <3,0.9102,Positive,0.7666666666666666,Positive,0.6363252401351929,Positive
お腹ほそ…🥺スタイル良すぎて,0.4404,Positive,0.7,Positive,0.2871746718883514,Neutral
يحلوهم لطيفات احبهم🫶🏻,0.802,Positive,0.5,Positive,0.348076730966568,Positive
29:08 i love you so much,0.6369,Positive,0.35,Positive,0.810386598110199,Positive
Chaeyoung again started being baby beast❤️-(7:45)❤️,0.0,Neutral,0.0,Neutral,0.3394287228584289,Positive
This women is so freakin cuuuute,0.0,Neutral,0.0,Neutral,-0.6608512997627258,Negative
"หลีดจีน่ารักที่สุดเลยค้าบ ❤️❤️❤️❤️
พอใช้คำแทนตัวเองว่าหนูแล้วรู้สึกแปลกๆ ฮ่าๆ",0.7184,Positive,0.075,Positive,0.2344103753566742,Neutral
"La persona que le dio esa misión es cruel, Sana literalmente es la serotonina de Jihyo 💜",0.1027,Positive,-1.0,Negative,-0.641761302947998,Negative
https://youtu.be/eTT0YfxSuDE,0.0,Neutral,0.0,Neutral,-0.2428914308547973,Negative
https://youtu.be/eTT0YfxSuDE,0.0,Neutral,0.0,Neutral,-0.2428914308547973,Negative
https://youtu.be/eTT0YfxSuDE,0.0,Neutral,0.0,Neutral,-0.2428914308547973,Negative
https://youtu.be/eTT0YfxSuDE,0.0,Neutral,0.0,Neutral,-0.2428914308547973,Negative
https://youtu.be/eTT0YfxSuDE,0.0,Neutral,0.0,Neutral,-0.2428914308547973,Negative
Jihyo Eonnie is soo beautiful and full of energy. I love and enjoyed this vlog soo much. Thankyouuuu eonnie for your hardwork. Stay healthy♡,0.9523,Positive,0.4800000000000001,Positive,0.8273017406463623,Positive
야무지게먹네,-0.4767,Negative,-0.6999999999999998,Negative,-0.2668129503726959,Negative
we love you!,0.6696,Positive,0.625,Positive,0.900912582874298,Positive
21:10 dahyun jokes are gold 😂,0.5994,Positive,0.0,Neutral,-0.3831072747707367,Negative
26:10 chaeyoung want to join with them but she shy shy shy,-0.6956,Negative,-0.5,Negative,0.3036105632781982,Neutral
Jihyo vlog so awesome all members appear in her vlogg,0.7384,Positive,1.0,Positive,0.8090340495109558,Positive
지효는 미소가 너무 이쁘다❤️❤️❤️❤️❤️,0.7408,Positive,0.325,Positive,0.4378985464572906,Positive
love twice ❤ amooooo,0.8555,Positive,0.5,Positive,0.6245124936103821,Positive
TOKIMEKI❤️🗻,0.0,Neutral,0.0,Neutral,0.3085779249668121,Neutral
cantik banget sayang,0.7947,Positive,0.85,Positive,0.3196079432964325,Neutral
🛐🛐🛐🛐🛐🛐🛐,0.9081,Positive,0.0,Neutral,0.3085779249668121,Neutral
the fact that Sana still flexing her berrys and apples even tho its not her Vlog,0.0,Neutral,0.0,Neutral,0.3410055339336395,Positive
ジヒョちゃんが使ってるファンデーションどこのかわかる人居ますかー？,0.0,Neutral,0.0,Neutral,0.2580333948135376,Neutral
when she focus the camera ahhh mygod Jihyo your so beautiful ❤,0.8874,Positive,0.85,Positive,0.4989827275276184,Positive
I hope they’ll get a chance to jump in the ocean on their encore leg.,0.5994,Positive,0.0,Neutral,0.3634691834449768,Positive
可愛い🤍🤍,0.4588,Positive,0.5,Positive,0.6078763604164124,Positive
Diosaaa😍😍🥰,0.9231,Positive,0.0,Neutral,0.3085779249668121,Neutral
"Why did Jihyo said ""i cant go outside""?",0.0,Neutral,0.0,Neutral,-0.4641940593719482,Negative
La otra semana sigue mi novia chayote,0.0,Neutral,-0.125,Negative,0.4197902381420135,Positive
Los mejores 30 minutos invertidos en mi vida,0.6369,Positive,0.45,Positive,0.8903775811195374,Positive
