Comment,Vader score,Vader label,TextBlob score,TextBlob label,BERT score,BERT label
when mark gets scared he just makes random noises and curses and i love it,0.3182,Positive,0.0,Neutral,0.6444156765937805,Positive
The daycare part was very difficult but you did it before everybody you keep your crown on,-0.2255,Negative,-0.65,Negative,0.3700912892818451,Positive
"This game looks crazy, i really like perhaps it's too much for me ^^",0.101,Positive,-0.15,Negative,0.3439014852046966,Positive
"Just coming back to look at Sun's animation because literally no one else watches him, and Sun's way more of a mess here than anywhere else and it honestly depicts his personality so well.",0.1968,Positive,0.23125,Neutral,0.6095738410949707,Positive
Markiplier much more calmer than the other times like this is like  probably the most Calmest he’s been,0.8653,Positive,0.2916666666666667,Neutral,-0.3182401657104492,Negative
Very interested in bones this episode are we?,0.4576,Positive,0.325,Neutral,0.4287250638008117,Positive
The sun and moon is the same person,0.0,Neutral,0.0,Neutral,-0.3043810129165649,Negative
Has eney one watch Willis wonderland?,0.0,Neutral,0.0,Neutral,-0.403051346540451,Negative
This is actually true your in 2038,0.4215,Positive,0.35,Positive,0.7358207702636719,Positive
The like-to-dislike ratio boggles my mind. Take what I said as you will; good or bad.,-0.1531,Negative,5.551115123125783e-17,Neutral,-0.360103577375412,Negative
I was abouta yell FREEDY FAZ NUTSACK when he said “oh wow”,0.0,Neutral,0.1,Neutral,-0.4798286855220794,Negative
"23:52
Yeah great job Markiplier you just figured out Vanny!",0.7644,Positive,1.0,Positive,0.7373730540275574,Positive
"mark: warning for nerds!
mark after 20 minutes or more: *jumpscared* AH
also roxy is my favourite",-0.4003,Negative,0.5,Positive,-0.3276232481002807,Negative
this game is so scary I was about to play the game and all sudden I'm stuck at level pass as guardians they were scared as fuck,-0.8783,Negative,-0.34,Negative,-0.6730884313583374,Negative
Mark saying wow and smiling through the intier intro fills me with joy.,0.891,Positive,0.45,Positive,0.7287312746047974,Positive
"While the intro isn't 100% accurate, it is better than 90% of movies or series that try to depict instruments being played.",0.6486,Positive,0.45,Positive,0.5086492896080017,Positive
bro,0.0,Neutral,0.0,Neutral,0.3016613125801086,Neutral
"Jumpscares:
Glamrock Chica 0:05 (Intro)
Glamrock Chica ""Jumpscare"" 17:44
Glamrock Chica 18:32
Glamrock Chica 24:48
Security Bot 26:23 (non-lethal)
Sun 33:22 (non-lethal)
Sun 34:21 (non-lethal)
Moon 39:39
Moon 43:07",0.34,Positive,0.0,Neutral,-0.2543461918830871,Negative
the balck guy is shadow bonny,0.0,Neutral,-0.1666666666666666,Negative,0.2482178956270218,Neutral
Def different from all the other fnafs gatta say I’m not that big a fan of this one but a new fnaf is a new fnaf might actually try and play this later,0.5789,Positive,0.0211038961038961,Neutral,0.3466002345085144,Positive
43:03 😍😜,0.4588,Positive,0.0,Neutral,0.2324748337268829,Neutral
He talks French at 10:00,0.0,Neutral,0.0,Neutral,0.2405247837305069,Neutral
I havent watched you in years,0.0,Neutral,0.0,Neutral,0.4012323021888733,Positive
fazballs,0.0,Neutral,0.0,Neutral,0.338966965675354,Positive
Mark just casually encouraging the animatronics,0.6249,Positive,-0.5000000000000001,Negative,0.4089841246604919,Positive
someones taking a dump someones taking a very impressive violent dump someones taking a murderously intense dump,-0.909,Negative,0.1333333333333333,Neutral,-0.6417021155357361,Negative
Wow you popular!!!,0.8164,Positive,0.55,Positive,0.8584699630737305,Positive
Feddy has his earring on the left ear which means he is straight,0.2263,Positive,0.1,Neutral,0.3590776324272156,Positive
is this the infinite warfare of the fnaf series,-0.296,Negative,0.0,Neutral,0.4257693290710449,Positive
*foxy,0.0,Neutral,0.0,Neutral,0.2227089703083038,Neutral
where is bonnie and roxy,0.0,Neutral,0.0,Neutral,0.2363792508840561,Neutral
"The past gong comparatively empty because step-aunt transmurally clap out a strange poultry. wild, shrill battle",-0.6369,Negative,-0.1399999999999999,Negative,-0.4076793193817138,Negative
I have trust issues so I'm gonna go with the suspicion that Freddy is really out to get us and that's why he wasted our time when we could've been out of there,-0.3612,Negative,0.0,Neutral,-0.4008513689041137,Negative
"28:10 i saw some of those plushies before at a GameStop in a mall, i didn't purchase one for idk why",-0.1027,Negative,0.0,Neutral,-0.3355262577533722,Negative
how did mark forget how he made a promise to the freddy plush in fnaf 4 to keep him safe🥺,0.5106,Positive,0.0,Neutral,0.3869022130966186,Positive
No one noticed but Freddy did Freddie Mercury’s fist thing in the intro,-0.1531,Negative,0.25,Neutral,0.2906127870082855,Neutral
I need him to go back and redo the burn trap ending bc it glitched out for him 💀,-0.3182,Negative,0.0,Neutral,-0.406166672706604,Negative
The fact that this has 0 dislikes makes me wanna watch this even more,-0.4019,Negative,0.5,Positive,-0.4149910807609558,Negative
"Hi. So I'm. ADDy 
What is your name",0.0,Neutral,0.0,Neutral,0.3219395577907562,Neutral
Fnaf 4 he says”keep me safe freddy” to the Freddy plush and now freddy says”I will keep you safe”freddy kept his promise❤️❤️,0.6369,Positive,0.5,Positive,0.4191038310527801,Positive
so they’re only open once a week “we’ll see you next week…” or is it just weekdays,0.0,Neutral,0.0,Neutral,0.3864369988441467,Positive
"OH!- One More.. If Someone Play The Security Breach And At The DayCare! If You Turn Of The Light And Go In The Play Place! If You Got ""3 Generators On! "" MoonDrop Will Get In The Play Place! If You Got 2 Or 1 Generators On! He Will Not Come In The Play Place! But If 3, 4 And 5! He Will Came In! And Kill You Sooooooooooooooooooooo~~~~ Easily~~~ 



SO BEE CAREFUL! :3  | UvU | UwU |",0.928,Positive,0.4866666666666667,Positive,-0.416599690914154,Negative
I'M JUST LIKE SOOOOOOOOOOOOOOOOOOOOO LONG LOOKING FOR THIS VIDEO! BECAUSE I WANNA SEE THE OTHER VIDEO- IT'S LIKE FREDDY IS JUST HELICOPTER HELICOPTER! I LOVE THAT PART! BUT IDK WHICH ONE AND NOW I FIND IT!,0.6876,Positive,0.1875,Neutral,0.3706260323524475,Positive
"24:06 - 24:26 In my opinion, the best moment in all fnaf games Markiplier has played.",0.765,Positive,1.0,Positive,0.776604175567627,Positive
The way his smile slowly creeps up his face as he listens to them play in the beginning is comedy gold,0.7506,Positive,-2.775557561562892e-17,Negative,0.4369783103466034,Positive
That was Monty's room,0.0,Neutral,0.0,Neutral,0.3095884621143341,Neutral
i saw gragory vent,0.0,Neutral,0.0,Neutral,-0.3060274124145508,Negative
I just watched this season for the 5th time and I enjoy it,0.4939,Positive,0.4,Positive,0.7184883952140808,Positive
Theoretically Gregory could’ve just stayed in Freddy and kept charging him for 5 hours and once the pizzaplex opened up he could just dip,0.0,Neutral,0.0,Neutral,-0.3570264875888824,Negative
I love it how Chica's earrings are connected directly to her head,0.6369,Positive,0.3,Neutral,0.791724443435669,Positive
1 million likes less gooo,0.4215,Positive,-0.1666666666666666,Negative,-0.4436720311641693,Negative
The new freddy design is actually pretty cool.,0.6705,Positive,0.2454545454545454,Neutral,0.5661935210227966,Positive
"''The one the only Freddy fazbear ""

Except there's like nine freddys",0.3612,Positive,0.0,Neutral,-0.2314499467611313,Negative
She was right about markipliers fans watching him right now,0.0,Neutral,0.2857142857142857,Neutral,0.3429320454597473,Positive
14:23 FREDDY YOUR SUPPOSED TO BE ON LOCKDOWN,0.0,Neutral,0.0,Neutral,-0.4202046990394592,Negative
ok so the security room was used in im pretty sure sister location and then the lounge place in it was williams or micheals room to watch the show,0.8548,Positive,0.4166666666666667,Positive,0.7444164752960205,Positive
Diva doesn’t suck,-0.4404,Negative,0.0,Neutral,0.239006221294403,Neutral
Do you doesn’t suck,-0.4404,Negative,0.0,Neutral,-0.3441637456417084,Negative
Mark you were so close to dying at 42:55,0.0,Neutral,0.0,Neutral,0.3234961330890655,Neutral
Freddy I will keep you safe wrong in every game freddy has killed me,-0.6908,Negative,-0.15,Negative,0.5351431965827942,Positive
I legit got scared that i spilled my water on me and threw the cap somewhere i dont even know😭😭 34:20,-0.8442,Negative,0.0,Neutral,-0.4078777134418487,Negative
my second time watching this 😍,0.5423,Positive,0.0,Neutral,0.4591960310935974,Positive
Why did Moon remind me so much of Gollum in Lord of the Rings??,0.0,Neutral,0.2,Neutral,-0.2639641463756561,Negative
I want to see a video animated about this game,0.0772,Positive,-0.4,Negative,0.3081645965576172,Neutral
My finger acendently touched the dislike dont worry tho i liked,0.0531,Positive,0.6,Positive,0.2577313184738159,Neutral
"Markiplier: they'll never find me
Chica: surprise mother fricker",0.2732,Positive,0.0,Neutral,0.2507140934467315,Neutral
"It hurts me so much, that throughout this entire series of videos, mark never figured out, that you can escape chica by getting out of the baby stroller just before she kills you",-0.7096,Negative,0.1,Neutral,0.4403835833072662,Positive
"Freddy: Your mother
Gregory: * insert sad piano music because he is homeless and technically an orphan * ;-;",-0.4767,Negative,-0.25,Negative,-0.4780780375003814,Negative
Mmmmmmmmmmmmmmmmmmmmmmmmmhekhllmmmmmmmmmmm.,0.0,Neutral,0.0,Neutral,-0.3585509955883026,Negative
10:00 en temps que fr jai vu flou je pensais que j'avais changer de vidéo xD,0.5267,Positive,0.0,Neutral,-0.4407469928264618,Negative
"""Someone is taking a very aggressive and violent dump""",-0.8251,Negative,-0.3,Negative,-0.5177451968193054,Negative
Its offensive to know that only *1 million* out of *27 million* liked the video-,-0.0516,Negative,0.3,Neutral,0.3107462227344513,Neutral
7:20 LMFAOOOO SHE BROKE THE 4TH WALL,-0.5473,Negative,0.0,Neutral,-0.6415714025497437,Negative
so basically FNAF has become Outlast,0.0,Neutral,0.0,Neutral,-0.4338148832321167,Negative
ben,0.0,Neutral,0.0,Neutral,0.3073336184024811,Neutral
SunDrop and MoonDrop are what my nightmares are made of.,0.0,Neutral,0.0,Neutral,0.6166186928749084,Positive
0:00 best clip,0.6369,Positive,1.0,Positive,-0.3607912361621856,Negative
Too much talking pretty annoying if you ask me,0.128,Positive,-0.1166666666666666,Negative,-0.5243828892707825,Negative
15:56 pretty sure that looks like fnaf 4 easter egg (crying child and the bullies),0.5994,Positive,0.1833333333333333,Neutral,0.2673529386520386,Neutral
"This game just looks weird and bad. Not getting the same vibes from the previous games. Not saying it's necessarily a bad thing to make changes, but this looks way too childish for me.",-0.7684,Negative,-0.3809523809523809,Negative,-0.5208197236061096,Negative
"This is the most terrifying fnaf game, I got more scared watching this playthrough than fnaf 4",-0.8012,Negative,-0.1,Negative,0.8472145795822144,Positive
Im wondering which gpu you have! I didnt got problems like you🤔,0.1129,Positive,0.0,Neutral,0.4198263883590698,Positive
Did Frazbear entertainment became the Disney of their universe or what,0.4215,Positive,0.0,Neutral,0.2497804909944534,Neutral
"STILL THE KING OF FNAF
A",0.0,Neutral,0.0,Neutral,0.5314007997512817,Positive
Chica looks like she is doing a ticktock dance and she got  1000000000000000000000000000000000000000000000000000000000000000000000000000000 dislikes,-0.0516,Negative,0.0,Neutral,-0.4432123899459839,Negative
"1 million likes man, you've grown so much 🥺",0.4215,Positive,0.2,Neutral,0.450095921754837,Positive
13:54 maybe because hes dead lmao,-0.1027,Negative,0.1999999999999999,Neutral,-0.4044969379901886,Negative
"Freddy: There's nothing to be scared of. :-)
Me: Says the 7 foot tall animatronic with glowing eyes.",0.5727,Positive,0.5,Positive,0.3264693021774292,Neutral
i feel like the “hate. hate. hate it. why is in in here with me?” is underrated,-0.7096,Negative,-0.8000000000000002,Negative,-0.548065721988678,Negative
"Wow, this is so different from previous games...",0.5859,Positive,-0.0222222222222222,Negative,0.8470744490623474,Positive
the year is 2029,0.0,Neutral,0.0,Neutral,0.3119950592517853,Neutral
15:59 that’s an among us reference from the polis map outside of the map where lab rotors is there are 3 snowmen of crew mates and a snowman of a dead body,-0.6486,Negative,-0.1,Negative,-0.4042969048023224,Negative
I'm still wondering when Freddy became a homosexual,0.0,Neutral,0.0,Neutral,0.3063503503799438,Neutral
okay so what if Vanny has control of all robots and you know Vanny wants Gregory so maybe when freddy says 'i feel you are broken i'm taking you to the first aid station' maybe it's just Vanny so he has less time to get back to the front desk so he can't go home 0.0,-0.296,Negative,0.0638888888888888,Neutral,0.7506518959999084,Positive
i love these,0.6369,Positive,0.5,Positive,0.8857296109199524,Positive
"nobody:
me thinking freddy fazbear is freddy mercury: 0-0",0.0,Neutral,0.0,Neutral,-0.8271123170852661,Negative
"OMG, when glam rock freddy said “ no, their is no rp dancing rabbit in the pizza plex anymore, WHAT HAPPENED TO BONNIE!?!, did gator take Bonnie’s place? Theirs a Bonnie’s bowl, but why did they get rid of bonnie, what a mystery… true rumor believes that the gator took his place… that means bonnie of coarse, maybe it has something to do with Vanny, I mean, Vanny is a killer rabbit while bonnie is a bunny or rabbit I should say, I believe that after Bonnie’s place was token, everything turned upside down, when Vanny came in,",-0.6998,Negative,-0.0295138888888889,Negative,-0.4600522816181183,Negative
The game is absolutely massive,0.0,Neutral,-0.2,Negative,-0.537846028804779,Negative
"Sun honestly feels like a frantic, overworked and very stressed daycare working. Well done",0.2516,Positive,0.4,Positive,-0.3779677152633667,Negative
but with the new 1.05 update the cables are color coded in the daycare,0.0,Neutral,0.1363636363636363,Neutral,0.351755678653717,Positive
"Don't worry mark, that was the last generator I found too",0.3412,Positive,0.0,Neutral,0.389581561088562,Positive
POV: you finally made it to security breach after rewatching the whole FNAF series,0.34,Positive,0.1,Neutral,-0.3824004828929901,Negative
"Freddy your supposed to be on lockdown 

But Vanessa I’m a material girl",0.0,Neutral,0.0,Neutral,-0.357087105512619,Negative
Love his vids. So funny!,0.8494,Positive,0.40625,Positive,0.8450365662574768,Positive
Lixian be on cues with the even scarier sounds 😭 like come on man....Keep it up tho🤍😂,0.3182,Positive,0.0,Neutral,0.2571909427642822,Neutral
"Freddy: ""Just climb into my chest cavity. You will be safe.""
Anyone with any amount of FNaF knowledge:   N O",0.4404,Positive,0.5,Positive,0.2594375610351562,Neutral
the king has returned,0.0,Neutral,0.0,Neutral,-0.2800284028053283,Negative
NOOOOOOOOOOOOOOOOOOOOOOOOOOOOOOOOOOOOOOOOOOOOOOOOOOOOO,0.0,Neutral,0.0,Neutral,-0.3035280108451843,Negative
Ahh yes put the backup generator switches inside the toddler slide cubbies that are too small for an employee get in to turn on. Fazzbear entertainment worker safety  laddies and gentlemen 😑.,0.8074,Positive,-0.25,Negative,-0.3392390012741089,Negative
I just wanted to say this is probably the most buggiest pos game to ever be released and I feel bad that you had to play a game that wasn’t ready to be played and was enemy close to being ready:,0.2023,Positive,-0.0999999999999999,Negative,-0.7792595028877258,Negative
hey like my video,0.3612,Positive,0.0,Neutral,0.4805392920970917,Positive
hello I liked your video and fnaf even better,0.6908,Positive,0.55,Positive,0.6414145827293396,Positive
maybe I will agree with that,0.3612,Positive,0.0,Neutral,0.4144797027111053,Positive
Why did he sound like Shaggy at 26:51 & 27:00,0.3612,Positive,0.4,Positive,-0.535028338432312,Negative
i thought mark wouldnt use hiding spots,0.2235,Positive,0.0,Neutral,-0.3236281871795654,Negative
im rewatching this again bc why not,0.0,Neutral,0.0,Neutral,-0.3594042360782623,Negative
14:14 my mom looking at me at 2am getting a snack,0.0,Neutral,0.0,Neutral,0.2343864142894745,Neutral
harga nya berapaan bang?,0.0,Neutral,0.0,Neutral,-0.3333556354045868,Negative
"I've had a question for a long time, why don't you just hide until in 6:00",0.1326,Positive,-0.05,Negative,-0.2691729664802551,Negative
Is that the bite of 87😯😮,0.0,Neutral,0.0,Neutral,0.3153819739818573,Neutral
Sean and marks gameplay is so different it's very entertaining,0.4927,Positive,0.325,Neutral,0.4811824858188629,Positive
"41:29 
mood",0.0,Neutral,0.0,Neutral,0.2624235153198242,Neutral
mat pat: ooh warnings,-0.296,Negative,0.0,Neutral,0.2621698677539825,Neutral
"Freddy: *explaining the daycare attendant being loose when the lights are out*
Mark, *directly after turning out the lights and seeing Moon* : why though?



*the lights are out my friend*",0.2263,Positive,0.0743589743589743,Neutral,-0.2984936535358429,Negative
*E*,0.0,Neutral,0.0,Neutral,-0.2384970188140869,Negative
You are not fine,-0.1511,Negative,-0.2083333333333333,Negative,-0.419979989528656,Negative
im watching bcz my laptop cant handle  the game,0.0,Neutral,-0.4,Negative,0.4919420778751373,Positive
35:08 I just love mark’s face expression to this 🤣,0.8126,Positive,0.5,Positive,0.7363318204879761,Positive
we are in the *year 2032* :0,0.0,Neutral,0.0,Neutral,-0.5443456768989563,Negative
22:49 Made me wheeze so hard,-0.2183,Negative,-0.2916666666666667,Negative,-0.5764760375022888,Negative
AsshOooOoooooOoOoooOolllle!!!,0.0,Neutral,0.0,Neutral,-0.2979627549648285,Negative
Imagine of this was vr but if u died in the game u die irl,-0.9052,Negative,-0.4,Negative,-0.3729305565357208,Negative
It takes place in 2023,0.0,Neutral,0.0,Neutral,0.3588390052318573,Positive
Officer Vanessa —,0.0,Neutral,0.0,Neutral,0.2465085834264755,Neutral
Never watch this while your half awake with headphones,0.0,Neutral,-0.1666666666666666,Negative,-0.6874286532402039,Negative
34:20 killed me,-0.6705,Negative,-0.2,Negative,-0.6345157027244568,Negative
hm intresting. never knew i have a better pc than mark xd,0.7717,Positive,0.5,Positive,-0.2477147728204727,Negative
09:38 Ironic. Children posing as animatronics.,-0.128,Negative,0.2,Neutral,-0.3533836603164673,Negative
That intro sounds like Mamma Mia.,0.0772,Positive,0.0,Neutral,0.267983078956604,Neutral
"They too so long to make this.




*AND BOY WAS IT WORTH IT*",0.3885,Positive,0.125,Neutral,0.486464649438858,Positive
Look how far FNAF came,0.0,Neutral,0.1,Neutral,0.3453457653522491,Positive
"Freddy: jump into my chest cavity

Me: oka- wait hold up",0.0,Neutral,0.0,Neutral,0.3288160264492035,Neutral
how this video unlock 27 millions in 4 months? in too much but is too good,0.5927,Positive,0.4499999999999999,Positive,-0.4145532548427582,Negative
sorry :( im just upset,-0.7003,Negative,-0.625,Negative,-0.496185839176178,Negative
this didnt help me at all,-0.3089,Negative,0.0,Neutral,-0.6869818568229675,Negative
"15:08 
Freddy: ""I will keep you safe.""

If you dont remember from fnaf 4 markiplier says that freddy promised to keep him safe, now hes doing just that. HOW WHOLESOME!🥰🥰",0.9726,Positive,0.5,Positive,0.4545201361179352,Positive
“Might as well get a picture of my excellence while I’m here” the most legendary words I have ever heard,0.7351,Positive,0.75,Positive,0.6421871781349182,Positive
"Vanessa: ""Freddy! You're supposed to be on lockdown!""
Freddy: ""officer Vanessa, I do not know how I got down here.""
Me: *disappointed he didn't say material gworl*",-0.5696,Negative,-0.4527777777777778,Negative,-0.5149338245391846,Negative
I find it so funny how I got an ad for security breach before this video lmao the 3d models for this game are amazing btw the FNAF franchise has gotten so much better quality throughout the years it's cool to see how far it's come since the first game.,0.9602,Positive,0.2055555555555555,Neutral,0.7097748517990112,Positive
Fun fact: Sun and Moon are voiced by the same person as Glamrock Freddy,0.5106,Positive,0.15,Neutral,0.5785995721817017,Positive
"Lol, just came back cuz i was vored and ended up watching the full series AGAIN",0.4215,Positive,0.3833333333333333,Positive,-0.389969140291214,Negative
"At the beginning: animatronics looking upwards
Mark: *looks up* dAd gOt tHe MiLk?",0.0,Neutral,0.0,Neutral,-0.310043603181839,Negative
this is not horror anymore 0:33,0.4585,Positive,0.0,Neutral,-0.6683462262153625,Negative
"Mark: *sneaking behind Chica* Chica you are so stupid...
Chica: *turns around* Talking shit about me?
Mark: O.O",-0.8885,Negative,-0.3374999999999999,Negative,-0.7172027230262756,Negative
"wait, the backroom? NO FREDDY DONT SEND ME THERE (i am refrencing 5:16)",-0.4466,Negative,0.0,Neutral,-0.4569922387599945,Negative
Glamrock freddy is Michael Afton and gregory is Evan/Chris Afton.,0.0,Neutral,0.0,Neutral,0.2967632114887237,Neutral
"2050
we're in 2050",0.0,Neutral,0.0,Neutral,0.45708167552948,Positive
"Man, this game is, a disappointment, I’ve tried to rewatch this series two times, already, Marks commentary is great but the actual gameplay is just, so, well shit. The story is basic and requires you to read every single note just so you can understand anything the characters say at the exit, the endings, sometimes have cinematics before cutting to random comic strips that seem really tacked on. Not to mention that none of the „antagonists“ actually antagonize you, Vanny pretty much appears based on chance, burntrap just comes out of nowhere, Vanessa, just disappears from the game half way through, it’s just disappointing.",-0.5493,Negative,-0.1081232492997198,Negative,-0.5827268362045288,Negative
"“You’ll never find me”
Immediately gets caught",0.0,Neutral,0.0,Neutral,-0.6636801362037659,Negative
15:53 Who is the impostor,0.0,Neutral,0.0,Neutral,-0.4844852983951568,Negative
U know what I really like the way u make ur intro sound,0.4201,Positive,0.3,Neutral,0.5151034593582153,Positive
How to do  da?!,0.0,Neutral,0.0,Neutral,0.3058058023452759,Neutral
I tried to download security breach only to have to refund it after discovering my PC couldnt run the damn game,0.5659,Positive,-0.2,Negative,-0.6122831106185913,Negative
you passed the last generator lol,0.4215,Positive,0.4,Positive,-0.3713389337062835,Negative
After mark finally finds the last generator he pulls out “the butthole lips”,0.0,Neutral,0.0,Neutral,0.2253941148519516,Neutral
"Gregory: *trying to find the backup generators*
Moon: *LITTERALLY FLYING*
Gregory: …",0.0,Neutral,0.0,Neutral,-0.281749814748764,Negative
MOONDROP IS TERRIFYING HOLY FUDGE,-0.5719,Negative,-1.0,Negative,0.70432049036026,Positive
I dont remember poop being able to run but okay :D,0.836,Positive,0.6666666666666666,Positive,0.5905081629753113,Positive
“Chica...If your weren’t... incredibly stupid you would know that there is- Woahahaohaoh”,-0.5709,Negative,-0.7999999999999999,Negative,-0.7013958692550659,Negative
Ruuuuuuunnn you ideyat,0.0,Neutral,0.0,Neutral,-0.2187192142009735,Negative
Five 2341 Freddy,0.0,Neutral,0.0,Neutral,0.9155527949333192,Positive
I wish freddy will see bonnie again well bonnie is gone freddy is sad must be his looking bunny i said that was there's no more rabbit at the pizza flex that must be bunny is gone,-0.128,Negative,-0.375,Negative,-0.3752245903015136,Negative
it's incredible to me that Gregory and Roxanne share the same voice actress,0.296,Positive,0.45,Positive,0.6389042735099792,Positive
"Gonna list all the clips when I literally jumped😭💀👍
26:24 
34:21
39:40
43:08",-0.4767,Negative,0.0,Neutral,-0.4579242467880249,Negative
Climbing into unconscious animatronics is very normal.,0.0,Neutral,0.195,Neutral,0.3432496190071106,Positive
Smart ending: Just be in Freddy's room until 6 AM,0.4019,Positive,0.2142857142857142,Neutral,0.4188649356365204,Positive
This game is very complex for a FNAF game.,0.0,Neutral,-0.3966666666666666,Negative,0.3432789146900177,Positive
You can tell the game wasn’t finished theres tons of glitches and stuff but i think its the fans for forcing the developers to put put the game because they were tired of waiting but theres a pandemic and working from home is hard so its no the developers fault,-0.9046,Negative,-0.3729166666666667,Negative,-0.4953761696815491,Negative
Using 2022 logic in 2038 logic,0.0,Neutral,0.0,Neutral,0.4819038808345794,Positive
This is pretty good!,0.75,Positive,0.5625,Positive,0.5248839855194092,Positive
I was eating ice cream at 7:52-8:06 and I nearly choked on it from laughter,0.0258,Neutral,0.1,Neutral,-0.4867564737796783,Negative
im losing my shit watching this @ x2 speed xD,-0.34,Negative,-0.2,Negative,-0.3592650294303894,Negative
Djhd,0.0,Neutral,0.0,Neutral,0.2579076588153839,Neutral
"Oh f*ck, the playlist",0.0,Neutral,0.0,Neutral,0.3286108374595642,Neutral
"When freddy started saying ""I'm sorry, I'm truly sorry "" it sounded like he was hacking something up because I wasn't paying attention at the time. just ""*HACK* I'm sorry, I'm truly sorry""",0.7269,Positive,-0.5,Negative,-0.677493155002594,Negative
el no sabe :D,0.0,Neutral,1.0,Positive,-0.4237275421619415,Negative
That jumpscare at 43:07 took me so much by surprise that i threw my blunt. I was holding it in between my fingers and when i jumped it flew away,0.3321,Positive,0.2,Neutral,-0.5317716002464294,Negative
"You: were is the  Complimental ticket  *finds it* oh am I dumb? Wait do agree to that 
Me:agreed",-0.2023,Negative,-0.375,Negative,-0.5099302530288696,Negative
Watching Mark’s face during the opening sequence is probably the funniest thing in the world.,0.5574,Positive,0.0,Neutral,0.6668766736984253,Positive
37:18 HOW YOU DO THAT!?!,0.0,Neutral,0.0,Neutral,0.3176361322402954,Neutral
