Comment,Vader score,Vader label,TextBlob score,TextBlob label,BERT score,BERT label
lets just wear the plastic so it doesn't ruin the planet,0.5164,Positive,0.0,Neutral,0.3885469138622284,Positive
Pleaseee do the reaction videos without Ken,0.0,Neutral,0.0,Neutral,-0.2844032943248749,Negative
"lmfao, the last one looks like the thing from little nightmares",0.7184,Positive,-0.09375,Negative,0.2411490827798843,Neutral
Edgar is so cute when pewds showed him 😭❤️❤️❤️,0.1941,Positive,0.5,Positive,0.369100958108902,Positive
Hey Felix has got a point tho like its more fun and you will learn a lot if you do it normally without shortcuts as plastic surgeries,0.7264,Positive,0.3166666666666667,Positive,0.4994659721851349,Positive
The first girl was actually really pretty before,0.5413,Positive,0.25,Positive,0.2470977306365966,Neutral
Lol I like how the perspectives on working out because I can’t relate to ken but can more to Felix. I know a lot of people relate to ken and I just can’t understand that mentality.,0.3919,Positive,0.65,Positive,0.4072382152080536,Positive
Ken sucks and he brings your videos down. I don’t watch any of the videos with ken.,-0.3612,Negative,-0.2277777777777778,Negative,-0.8042243719100952,Negative
The best thing any hackers or people will get off my phone… is my Wattpad account,0.6369,Positive,1.0,Positive,0.9006458520889282,Positive
Bring back the 480p PewDiePie,0.0,Neutral,0.0,Neutral,0.4157931804656982,Positive
Damn first girl was fine,-0.2263,Negative,0.3333333333333333,Positive,0.2382819056510925,Neutral
"Ever since I’ve started to workout, my mental health started getting much better , always remember you’re worth it and you’re beautiful just the way u r 💖",0.9337,Positive,0.3874999999999999,Positive,0.8327798247337341,Positive
"Child turns 18
Marzia: probably throws very cute birthday party
Felix: ""SAYONARA MOTHERFUCKA I DON'T OWE YOU SHIT""",0.8665,Positive,0.225,Positive,0.3126057684421539,Neutral
when you running out of ideas,0.0,Neutral,0.0,Neutral,0.2132969945669174,Neutral
"I am lowkey worried about your dog pewdiepie.
I feel like he's slowly dying",0.0772,Positive,-0.3,Negative,-0.4629321694374084,Negative
Elder Scrolls: Oblivion character customization irl,0.0,Neutral,0.0,Neutral,0.396094799041748,Positive
Bruh I will never understand the muscle implants... JUST FUCKING WORK OUT,0.0,Neutral,-0.6,Negative,-0.6306635737419128,Negative
"bro, i'm a vietnamese, i'm commenting to ask you to speak up about the scandal in vietnam between k o a p u g and j o h n y d a n g",-0.4404,Negative,0.0,Neutral,-0.4545305669307709,Negative
Why is Edgar so Damn cute,-0.0549,Negative,0.5,Positive,0.2979881465435028,Neutral
ZAMM Shes 12? 😜,0.0,Neutral,0.0,Neutral,-0.4050423502922058,Negative
Plastic surgery is pay to win,0.5267,Positive,0.8,Positive,0.2883542478084564,Neutral
Why,0.0,Neutral,0.0,Neutral,-0.2811063528060913,Negative
The vedio is cursed,0.0,Neutral,0.0,Neutral,-0.5795041918754578,Negative
"i find these funny :P 
hey don't judge me :P 
these ppl should know better then to get plastic surgeries they rarely ever! end well :P",0.8157,Positive,0.5625,Positive,0.2870230972766876,Neutral
"I'd understand if they are not that good looking and they want to be happy.. but holy moly, they are beautiful before the surgery.",0.7991,Positive,0.7833333333333333,Positive,0.377359390258789,Positive
"On the first one, where tf are her organs stored 😂lmaooo",-0.2263,Negative,0.25,Positive,0.2649473249912262,Neutral
I can't believe Felix teleported back to UK to do the sponsor! A hardworking business man!,0.0,Neutral,0.0,Neutral,-0.76026451587677,Negative
I can picture ken bald and it actually looks prettig good i Think he should go bald,0.4404,Positive,0.35,Positive,0.3850826323032379,Positive
Ken should stop being in this videos,-0.296,Negative,0.0,Neutral,-0.4117796123027801,Negative
"if you force me into existense, I want compensation",0.0772,Positive,0.0,Neutral,-0.3451740443706512,Negative
"omg, i haven't seen Edgar in YEARS, he looks like a sad old man :(",-0.5423,Negative,-0.3833333333333333,Negative,-0.3937296271324157,Negative
isn´t pixee fox swedish,0.0,Neutral,0.0,Neutral,-0.2940585315227508,Negative
I would sell my soul to have plastic surgery. I don't care about the consequences.,-0.3875,Negative,0.0,Neutral,-0.3810174763202667,Negative
6:34 pewdz how many arms do you got?,0.0,Neutral,0.5,Positive,-0.2707701325416565,Negative
you guys should do a react to the kitchen nightmares secret gardien épisode !!,0.0,Neutral,-0.625,Negative,0.5031173825263977,Positive
you guys should do a react to the kitchen nightmares secret gardien épisode !!,0.0,Neutral,-0.625,Negative,0.5031173825263977,Positive
"It’s crazy how clearly these people are troubled and need therapy but there is a whole business targeted for them. 

The attention they get is really enabling and feeds their delusion.

Find me one person with a bunch of injections that has it together. At peace and doesn’t care what people think and doesn’t have an addiction in any forms, like drugs, gambling, shopping etc.",0.9091,Positive,-0.12,Negative,-0.2891687750816345,Negative
"""Love yourself for the way you are, you are perfect""

LGTVHD+ movement: ""I guess I'll just go home then...""",0.836,Positive,0.75,Positive,0.6515046954154968,Positive
IF you have a wife???? *angry italian noises intensify🤌🏻,-0.644,Negative,-0.25,Negative,-0.6300497651100159,Negative
It's alarming seeing people turning into monsters all because they feel self conscious about their natural look.,0.25,Positive,0.0333333333333333,Positive,-0.4465655088424682,Negative
How…..is that first lady ALIVE. WHERE ARE HER ORGANS?!,0.561,Positive,0.1875,Positive,-0.4145246744155884,Negative
"The thing about the doctors is, the reputable ones will say no (eventually) but than these people turn to complete quacks who will do the surgeries for the money.",-0.1531,Negative,0.3,Positive,-0.4120912253856659,Negative
Just cut some of the large intestine to get thinner. Its “large” so clearly theres some extra,0.3381,Positive,0.1321428571428571,Positive,0.4865600168704986,Positive
Phew.. at least I didnt pay a whole lot if money to be as ugly as I am,-0.4596,Negative,-0.2666666666666666,Negative,-0.5320172905921936,Negative
When is Edgar getting the recognition he deserves by getting sponsored and his own promo code?!???!?!?!?!?!,0.0,Neutral,1.0,Positive,-0.4848047196865082,Negative
Having metal in your mouth in the cold would feel so painful. Maybe,-0.5777,Negative,-0.6499999999999999,Negative,-0.4311110973358154,Negative
"""Your unfailing love, O LORD, is as vast as the heavens; your faithfulness reaches beyond the clouds. Your righteousness is like the mighty mountains, Your justice like the ocean depths. You care for people and animals alike, O LORD. How precious is Your unfailing love, O God! All humanity finds shelter in the shadow of Your wings."" (Psalm 36:5-7)",0.9847,Positive,0.4049999999999999,Positive,0.8785849809646606,Positive
Love yourself 💜,0.8555,Positive,0.5,Positive,0.7855013608932495,Positive
The lady who got 2.5 billion and 100 million a year filed for bankruptcy in 2018.,0.0,Neutral,0.0,Neutral,-0.8226485252380371,Negative
"""...is it sad or...""
It's as if disturbing took a sad and depression pill and washed it down with vodka pity.",-0.9371,Negative,-0.3511111111111111,Negative,-0.4070685505867004,Negative
Pretty sure I clicked something about plastic surgery not Blastic surgery.....,0.6705,Positive,0.375,Positive,0.3767779469490051,Positive
"Since my parents divorced my mom receives alimony as well. But  I think in her case it's fair. She stayed at home to care for me and my two siblings while my dad worked. She didn't have a chance to save money for her retirement, get job experience and s.o. So when they divorced my mom had to look for a job without any experience in the last 17 years. Having you wife stay at home and take care of *your* children, then divorcing her without owing her anything would be fucked up.",0.8477,Positive,0.0333333333333333,Positive,0.4709396660327911,Positive
"The last one is a bit false. She used to be a real pretty underground singer and wanted to change the shape of her face and had to go through multiple plastic surgeries. After many unsatisfying plastic surgeries to her taste she got body dysmorphic disorder  She then started to inject paraffin and soybean oil to her face. Her story came to light in Korea due to a documentary. The size of her face was reduced with medical intervention but her face was still extremely deformed. She passed away 2 years ago at the age of 57. 
The pics are wrong too, the previous ones.",-0.5994,Negative,-0.0034722222222222,Negative,-0.4799290001392364,Negative
11:03,0.0,Neutral,0.0,Neutral,-0.2890697121620178,Negative
there are many vietnamese people watching you but i can't see the subtitles so can you add vietnamese subtitles and each video please,0.4497,Positive,0.5,Positive,0.2998166680335998,Neutral
Pwedie the type of guy to watch (how cats poop),0.0,Neutral,0.0,Neutral,0.3010147511959076,Neutral
"Often the problem is that if this doctor doesn't do the surgery, another one will, so might as well cash in",-0.0865,Negative,0.0,Neutral,-0.3579274415969848,Negative
3:40 hehehe KENanu Reeves,0.0,Neutral,0.0,Neutral,0.2957314848899841,Neutral
3:16 she was so gorgeous ):,0.4657,Positive,0.7,Positive,0.629858136177063,Positive
"The voice in the video (the narrator), is that Nemrap's voice?",0.0,Neutral,0.0,Neutral,-0.3042674660682678,Negative
Horrifying..,-0.5719,Negative,-0.9,Negative,-0.8688636422157288,Negative
Edgar oroa dig inte jag har redan Nord.,0.3412,Positive,0.0,Neutral,-0.3699217140674591,Negative
"Kens Logic Vs Pewdiepie's Philosophy.

5:00

I agree with both.",0.3612,Positive,0.0,Neutral,0.2212944477796554,Neutral
"I need Oli London on this list, like Jesus Christ he looks like he could melt any second in the sun",0.6124,Positive,0.0,Neutral,-0.4604148268699646,Negative
1:43 man-made hard air bags for the cost of 6 ribs,-0.1027,Negative,-0.2916666666666667,Negative,0.2628230154514313,Neutral
"""He wants to look good too, so he's just paying for it in stead of... you know... using his time and effort"". Then you realize he'll never actually reach that point until he's dead",-0.3557,Negative,0.175,Positive,0.2777186036109924,Neutral
Meanwhile Hollywood actors/actress : hold my beer😂😂😂,0.8271,Positive,0.0,Neutral,0.2389230728149414,Neutral
"So like if you have metal back supports, do you have to have medical doccuments that says its there if you ding the metal detector on a plane or something? Idk it came across my mind randomly",0.5984,Positive,-0.1666666666666666,Negative,0.3140114843845367,Neutral
hi beautiful🥔😍,0.7845,Positive,0.0,Neutral,0.3258702754974365,Neutral
"11:12, I paused the video in chock and just stared and said: what",0.0,Neutral,0.0,Neutral,-0.5338520407676697,Negative
T series now have 200 million subscribers,0.0,Neutral,0.0,Neutral,0.3775514364242553,Positive
This is why I would never have a plastic surgary cause its dangerous for my face,-0.4767,Negative,-0.6,Negative,-0.3887351453304291,Negative
3:25 Look like James Charles,0.3612,Positive,0.0,Neutral,0.2908649742603302,Neutral
"Those guy who did plastic surgery don't love their body.i mean if ur face already beautiful,why do plastic surgery? hypocrite human.sassy baka",-0.5216,Negative,0.09375,Positive,-0.4200350344181061,Negative
"If I had the money to perform many surgeries on myself I would have used that money to get someone to help me with body dysmorphic disorder. Like if I was to do plastic surgery I still won’t be able to get rid of the mental image of myself everytime I look at the mirror. Changing yourself physically isn’t going to help you change mentally too. You can’t just hate how you look and change your imperfections and suddenly love yourself. It doesn’t work like that for me. If I can afford plastic surgery I would get a coach or someone to just guide my through training and hard work and I’ll get to my goal through that. I want to feel better, not just be better about myself. I think that it’s better to suffer through hardship and achieve something and feel actually good about yourself from it instead of doing nothing but spending money on yourself and you just don’t know when to stop because you don’t see that you’re already good the way you are.",0.7047,Positive,0.2391025641025641,Positive,-0.497341901063919,Negative
As women we can actually push most of our organs up into our rib cage because that’s what happens during pregnancy,0.0,Neutral,0.25,Positive,0.3503816425800323,Positive
Eat your cereal,0.0,Neutral,0.0,Neutral,0.4095023572444916,Positive
The google Fi girls makes me wanna throw hands,0.0,Neutral,0.0,Neutral,0.3971559405326843,Positive
"I just watched a video about the last woman called The Singer Who Injected Oil into Her Own Face. Sadly, Hang died in 2018. The video is interesting because it shows many pictures of her when she was a singer and how her facial changes progressed. She was able to get some surgery to remove much of the stuff she put in her face, it did look much better.",-0.2023,Negative,0.2555555555555555,Positive,0.3623044788837433,Positive
Sorry to repeat about body dismorphia. I will say that my former client did make major improvement with cognitive behavioral therapy and it took a long time. But she appears comfortable in her body now as comfortable as most people.,0.8978,Positive,0.1160714285714285,Positive,0.3840126097202301,Positive
I love Botched because they usually have an extreme case they reject and the rest of the time fix bad surgeries or injuries/deformities.,-0.3102,Negative,-0.1437499999999999,Negative,0.393393337726593,Positive
She Jabba the Hutted herself,0.0,Neutral,0.0,Neutral,-0.3058947622776031,Negative
"Me, hating myself for gaining fifteen lbs in the hospital and getting to a whopping 110

Pewds: Love yourself the way you are, you’re beautiful 

Ok 😁 thanks bud ❤️",0.9403,Positive,0.5125000000000001,Positive,0.436474472284317,Positive
Alimony is SO weird.,-0.4866,Negative,-0.5,Negative,-0.3341099619865417,Negative
Whenever I decide to eat food while watching your videos it always ends up being the grossest ones,-0.4767,Negative,0.0,Neutral,0.3332148492336273,Positive
"Intro be like "" Dreams are messages from the deep""",0.6369,Positive,0.0,Neutral,0.2587939500808716,Neutral
This is going Hunger Games levels of face alteration.,-0.25,Negative,0.0,Neutral,-0.4426833093166351,Negative
Anyone else notice that Felix has a mic on a mic true ledgend,0.4215,Positive,0.35,Positive,0.3417679369449615,Positive
"I honestly feel uncomfortable looking at them, I feel so bad for them but I just can’t help feeling weird",0.1789,Positive,-0.2749999999999999,Negative,-0.4667212069034576,Negative
"For those replicating dolls...I feel like they forget that dolls intend to replicate people...and that's especially apparent as we see a fight towards more diverse dolls, because kids are supposed to feel represented, not confined by them.",-0.25,Negative,0.3,Positive,0.3173572123050689,Neutral
"NemRaps as the narrator, pretty cool.",0.6705,Positive,0.3,Positive,0.5153932571411133,Positive
"**imo** i think that pewds makes the best content by himself and he’s always seemed so anxious in collabs, i wish he did more videos by himself with the same content in videos with ken",0.6467,Positive,0.3125,Positive,0.3480338454246521,Positive
i don’t think people truly realize how money hungry doctors truly are…,0.7003,Positive,0.0,Neutral,-0.433608204126358,Negative
"So, that Ken doll dude....
What would happen if he just took a punch to the face? That's all I could think about 😂",0.4404,Positive,0.0,Neutral,0.3266887068748474,Neutral
"What doctor agrees to remove ribs just for the heck of it?
That's utterly ridiculous",-0.2484,Negative,-0.3333333333333333,Negative,-0.7157748937606812,Negative
Pews Dune voice is great!,0.6588,Positive,1.0,Positive,0.686653733253479,Positive
Pewds starts the video with throat singing. 10/10,0.0,Neutral,0.0,Neutral,-0.3219652473926544,Negative
Does anyone know what mic he is using?,0.0,Neutral,0.0,Neutral,-0.2933117151260376,Negative
"here's an idea: we send all those guys' surgeons to an island, where they must fight each other for their survival.",-0.3818,Negative,-0.125,Negative,0.3472047448158264,Positive
The black alien project,0.0,Neutral,-0.2083333333333333,Negative,0.2923974990844726,Neutral
"Honestly, being a furry right now wouldn't be as bad as this..",0.705,Positive,0.0619047619047619,Positive,0.3447009623050689,Positive
"*looking at college costs these days* Felix, your hypothetical kids is gonna lack a degree bruh",-0.3182,Negative,0.0,Neutral,-0.414419561624527,Negative
I shall never plastic surgery,0.0,Neutral,0.0,Neutral,0.31491419672966,Neutral
Fuck. We all are getting so fucking old.,-0.5423,Negative,-0.15,Negative,-0.8096910119056702,Negative
They should call plastic surgery at some of these levels a drug overdose,0.0,Neutral,0.0,Neutral,-0.3681193590164184,Negative
"Pixie Fox had a nose job and ended up with brain damage and is now living a nice, simple life recovering with her friends and family.",0.4019,Positive,0.3,Positive,0.4933435916900635,Positive
*message from me to pews* :   have baby,0.0,Neutral,0.0,Neutral,-0.3168449401855469,Negative
Lol,0.4215,Positive,0.8,Positive,0.2506950199604034,Neutral
Someone should make a new list and add Oli London to it,0.0,Neutral,0.1363636363636363,Positive,0.2666774690151214,Neutral
Cat lady looks like the troll face,0.3612,Positive,0.0,Neutral,0.3133663833141327,Neutral
Ken bought? Dump it.,-0.3818,Negative,0.0,Neutral,-0.702600359916687,Negative
Doctors can't use a knife and a needle to fix a mental problem. Learn to love yourself and accept life as it comes and you will be happy,0.8316,Positive,0.4000000000000001,Positive,0.6198980212211609,Positive
Dr ain't here to help lolol its for the money,-0.3089,Negative,0.8,Positive,-0.3940127193927765,Negative
Stop saying Ken doll I'm getting flashbacks of the elementary school playground 😅😭🤣😂,0.5106,Positive,0.3,Positive,-0.3289674520492553,Negative
Such a good point you have made here. Many doctors are abusing mentally confused people to get money instead of providing real help. This is wrong.,-0.4215,Negative,0.0833333333333333,Positive,0.3835473954677582,Positive
"Me: Puts lighter near them
Them: *starts melting*",0.0,Neutral,0.1,Positive,-0.4050154089927673,Negative
This is more sad than funny,-0.0591,Negative,0.0833333333333333,Positive,-0.3966335356235504,Negative
LOL funny Pewds & Ken I liked this video yes!!!!👍😅,0.9393,Positive,0.5499999999999999,Positive,0.6158058643341064,Positive
6:17 yo..mah man promoting piracy at it's peak xd,0.743,Positive,0.0,Neutral,-0.6625166535377502,Negative
Kocham,0.6369,Positive,0.5,Positive,0.4134881496429443,Positive
I love Ken's sincerity. No bullshit.,0.8059,Positive,0.5,Positive,0.7606521844863892,Positive
The whole kardasin ppl should be here,0.0,Neutral,0.2,Positive,0.3945877850055694,Positive
"alimony has nothing to do with kids, child support is kids.  Alimony is made literally just to pay the woman so she can maintain a similar lifestyle.  It's nuts.",-0.0,Neutral,0.0,Neutral,-0.4860162138938904,Negative
I used to have cinnamon mindset about diets but after going through self improvement and losing alot of weight and keeping it off I agree with pewdiepie alot more,0.5927,Positive,0.5,Positive,0.2999154031276703,Neutral
My reaction was same as PewDiePies after seeing her swollen face,0.0,Neutral,0.0,Neutral,-0.2347918599843979,Negative
"Why tf this 2:41 sounded like 808 bass, I'm sure if someone will use it in a fkn beat it's gonna sound dope",0.5859,Positive,0.25,Positive,-0.3732470273971557,Negative
Umm I know you a popular you tuber but SINCE WHEN DID YOU GET 110M SUBS,0.2263,Positive,0.6,Positive,0.3040013909339905,Neutral
🤬,0.0,Neutral,0.0,Neutral,0.3085779249668121,Neutral
*FUN FACT!* In the 18th century Corsets were wildly popular but It can cause and aid uterine prolapse.,0.5731,Positive,0.4875,Positive,0.568295419216156,Positive
9:06 can I get a quick rundown?,0.0,Neutral,0.3333333333333333,Positive,-0.2847512066364288,Negative
"9:52 all nineteen years olders crying, pewds would dumped them from home",-0.7003,Negative,-0.2,Negative,-0.3824591934680938,Negative
"5:54 at this point, we all have become Edgar",0.0,Neutral,0.0,Neutral,0.5174310207366943,Positive
pewds camera has been upgraded?,0.0,Neutral,0.0,Neutral,0.3151530623435974,Neutral
2:34 Yo that makes two of us,0.0,Neutral,0.0,Neutral,-0.3123603463172912,Negative
Great!!!now the porn sites dont know where i life anymore !!!!,0.0,Neutral,0.0,Neutral,0.8471788167953491,Positive
"What the hell man, why didn't you put Ken in the title or the thumbnail. I would've clicked faster to watch this video. Jeez, get it together pewds. You'll never make it to Ken's level at this rate.",-0.6808,Negative,0.0,Neutral,-0.5793167948722839,Negative
"Your genius putting that beautiful animal so that we watch everypart of the video.
Congrats Edgar",0.8074,Positive,0.85,Positive,0.8589350581169128,Positive
Oli London best be there,0.6369,Positive,1.0,Positive,0.3210256993770599,Neutral
"in my opinion plastic surgeons are like drugs dealers. Both having the same motto ""if im not gonna do it, someone else will.''",0.3612,Positive,0.0,Neutral,-0.2534516155719757,Negative
5:14 totally agree with Pewds. Working out benefits your mental health tremendously as well as helping physical wellbeing.,0.839,Positive,0.0583333333333333,Positive,0.750817060470581,Positive
NORDVPN is not safe. Stop recommending them,-0.1326,Negative,-0.25,Negative,-0.5716214179992676,Negative
I've decided I like these videos because Pewds yells like a poor man while being nowhere close.,0.2263,Positive,-0.4,Negative,0.4484487175941467,Positive
thats a nice flannel ken,0.4215,Positive,0.6,Positive,0.4307453334331512,Positive
"Got a plastic surgery ad, daaaamn",0.0,Neutral,0.0,Neutral,0.2493294030427932,Neutral
Surgery is a bad idea and the gym just sucks. My path to aesthetics needs to be the acceptance of being thicc.  :U,-0.4588,Negative,-0.4999999999999999,Negative,-0.6456728577613831,Negative
Let's use this comment as the dislike button...,-0.3818,Negative,0.0,Neutral,-0.2673476934432983,Negative
"e

XxEpicofgaemers99xX",0.0,Neutral,0.0,Neutral,0.3127737939357757,Neutral
Buy multivac next generation blockchain,0.0,Neutral,0.0,Neutral,0.5653291940689087,Positive
"I use it everytime 

Yea say no more we know",-0.296,Negative,-0.25,Negative,0.6483734250068665,Positive
"Hey, I know Pixee... I even gave her that name!
True story!",0.5242,Positive,0.4375,Positive,0.8132374882698059,Positive
These people need brain implants,0.0,Neutral,0.0,Neutral,-0.2535223364830017,Negative
Bro 👍,0.0,Neutral,0.0,Neutral,0.2868380546569824,Neutral
Any indication that this has Ken/ A guest would be great. Saves me the trouble of clicking on these poorly structured videos.,0.34,Positive,0.0666666666666667,Positive,-0.4096512496471405,Negative
"The sad thing is, after surgery, none of them look good. They were better before.",0.4019,Positive,0.2333333333333333,Positive,-0.4717642366886139,Negative
"To the person who is reading this, don't give up on your YouTube channel, keep going, it's going to get better!!!",0.5826,Positive,0.9765625,Positive,-0.3724546134471893,Negative
2:58 Bluetooth intestines,0.0,Neutral,0.0,Neutral,0.2273580729961395,Neutral
"Bruh I know people do this just to look good or what but for God's sake just appreciate for what you look like today, its natural beauty and you know you'd regret it in the end, plus you pay up lots of wasted money on something isn't necessary to do or to have.",0.8225,Positive,0.1499999999999999,Positive,-0.4680920243263244,Negative
[Comment Deleted],0.0,Neutral,0.0,Neutral,-0.2720911800861358,Negative
Uncle Rey!!!,0.0,Neutral,0.0,Neutral,0.5015386939048767,Positive
The sidemen just reacted to the same video in the same day of uploading the video 😂😳😳😂😂🤯,0.8271,Positive,0.0,Neutral,-0.4751816689968109,Negative
Pewds opened this vid with a Sardaukar chant.,0.0,Neutral,0.0,Neutral,-0.329593300819397,Negative
"said it once and i’ll say it again, it’s unfair that most people can freely do this to themselves but trans people have to jump through hoops of fire to get anything done.",-0.471,Negative,0.1333333333333333,Positive,-0.5082060694694519,Negative
Uuuuuuuh,0.0,Neutral,0.0,Neutral,-0.2360922843217849,Negative
Use Nord...Mead,0.0,Neutral,0.0,Neutral,0.2981014847755432,Neutral
12:18 I wish I can pewds.. I wish I can.,0.6597,Positive,0.0,Neutral,0.2450849860906601,Neutral
I think minor plastic surgery is fine. Or more major surgery to help recover from some horrific accident. But some people just blatantly take it way too far.,-0.3331,Negative,-0.0672619047619047,Negative,0.6006830334663391,Positive
0:00 pov you're watching Dune,0.0,Neutral,0.0,Neutral,-0.5654215216636658,Negative
J,0.0,Neutral,0.0,Neutral,0.2888481020927429,Neutral
that last one looked like one of the creatures in little nightmares,0.3612,Positive,-0.09375,Negative,-0.2844200730323791,Negative
Oli London Be Like: *that's cute*,0.6705,Positive,0.5,Positive,0.3116816282272339,Neutral
5:50 bruh cmon,0.0,Neutral,0.0,Neutral,-0.4234474301338196,Negative
Silkesha,0.0,Neutral,0.0,Neutral,0.2405519932508468,Neutral
I actually watched the ad and didn't skip it like I normally do because Edgar is so cute. ❤️,0.413,Positive,0.2166666666666666,Positive,0.462565153837204,Positive
More of this sh**t!,0.0,Neutral,0.625,Positive,-0.6522119045257568,Negative
Hi,0.0,Neutral,0.0,Neutral,0.2364865690469741,Neutral
I'm from Indonesia,0.0,Neutral,0.0,Neutral,-0.3539673686027527,Negative
