Comment,Vader score,Vader label,TextBlob score,TextBlob label,BERT score,BERT label
I watched the VPN sponsored part just to look at Edgar,0.0,Neutral,0.0,Neutral,-0.2189001142978668,Negative
"To be fair, Justin designed his own implants. Those didn't exist, and as I recall they've helped people who end up deformed in some ways to look like they used to. So he did put significant effort into looking the way he does, working out just wasn't the way he did it.",0.6808,Positive,0.5583333333333332,Positive,0.4518367052078247,Positive
I wish they would’ve finished listening to the last story…,0.4019,Positive,0.0,Neutral,0.3332041501998901,Positive
"Anyone notice that PewDiePie actually used one of those ""shocked"" thumbnail faces?",-0.3182,Negative,-0.35,Negative,-0.4884395897388458,Negative
Plastic surgery like this is some Junji Ito level horror mixed with a strong uncanny valley vibe.,0.2732,Positive,0.2166666666666666,Positive,0.4137994647026062,Positive
Is that Nem narrating?,0.0,Neutral,0.0,Neutral,-0.4498713612556457,Negative
I don't feel good after watching this.,-0.3412,Negative,0.7,Positive,-0.4887594580650329,Negative
Pixee Fox = Your mind on feminine beauty standards,0.5859,Positive,0.0,Neutral,0.397838294506073,Positive
I love how pewds peaked his mic at 8:11 to 8:38 hope your mic an broke pewds if you see this buy a back up mic please incase your current one breaks,0.765,Positive,0.1666666666666666,Positive,-0.5764365196228027,Negative
Started the video out eating and lost my appetite when I saw that girls waist...,-0.3182,Negative,0.0,Neutral,-0.4514389038085937,Negative
12:19 ✨,0.3182,Positive,0.0,Neutral,-0.2323379963636398,Negative
"She became caveman.
Abuga boo.",0.0,Neutral,0.0,Neutral,-0.4060603380203247,Negative
Change my mind: This kind of plastic surgery is rooted in mental health issues.,0.0,Neutral,0.25,Positive,0.2282756268978119,Neutral
0:00 he speaks like this as he progressively gets older,0.3612,Positive,0.1666666666666666,Positive,-0.2921998202800751,Negative
Ken paid for his chad jawline.,0.0,Neutral,0.0,Neutral,0.2337553948163986,Neutral
It dogs so cute,0.5949,Positive,0.5,Positive,0.4960646629333496,Positive
The topic I didn't know I needed to see,0.0,Neutral,0.0,Neutral,0.2872858047485351,Neutral
sub u could win a billion,0.5859,Positive,0.8,Positive,-0.3571672737598419,Negative
"""Vanity... My favorite sin"" - Devil's Advocate (1997)",-0.3612,Negative,0.5,Positive,0.6462676525115967,Positive
"Love yourself, for the way you are.
You are perfect. You are beautiful. 🥺",0.9153,Positive,0.7833333333333333,Positive,0.9382709860801696,Positive
"I'm watching this in 3 am, seems like a bad idea.",-0.25,Negative,-0.6999999999999998,Negative,-0.3417756855487823,Negative
"Ken, please don’t get a hair transplant",0.3182,Positive,0.0,Neutral,-0.5238909721374512,Negative
Floor gang ouewwwwwww,0.0,Neutral,0.0,Neutral,-0.3101863265037536,Negative
I had jaw surgery like Ken so I understand him lol,0.6486,Positive,0.8,Positive,0.2715851664543152,Neutral
"""Love your self you perfect, your beautiful!!"" 
-felix 2021 November 30",0.9244,Positive,0.8333333333333334,Positive,0.8582316040992737,Positive
That first girl looks like a barbie doll that was left out in the sun on the pavement for too long,0.3612,Positive,0.0666666666666666,Positive,-0.3525559306144714,Negative
Ok now my sister had a Ken doll as a kid and if you take off the pants there's nothing in there man. Some physiques are not goals.,0.296,Positive,0.5,Positive,0.8080287575721741,Positive
how does it feel to have 100m subs,0.0,Neutral,0.0,Neutral,0.44969642162323,Positive
Why does Pewds look sick? His eyes are looking like someone who's suffering from something. Hope I'm wrong and he's ok,-0.4404,Negative,-0.2380952380952381,Negative,0.4041945934295654,Positive
I watched that video a long time ago and got scared 😂😂,0.4404,Positive,-0.05,Negative,0.5751882195472717,Positive
thumbnail 100,0.0,Neutral,0.0,Neutral,0.5934894680976868,Positive
Why are u so mean,0.0,Neutral,-0.3125,Negative,-0.338998794555664,Negative
I would never understand these people because they let kid toys control their lives.,0.0,Neutral,0.0,Neutral,-0.3652123212814331,Negative
Edgar looks so cute,0.5949,Positive,0.5,Positive,0.555791974067688,Positive
"If I could have whatever I wanted whenever I wanted I would be entirely fulfilled. I do not understand the philosophy that things have to suck for you to enjoy things. If I could relax, then I could enjoy things. But I don’t even have time for that which is why I watch 13 minute videos on YouTube before I go to bed and start another day. It’s just like, rich people copium so they don’t feel bad about being rich.",0.9266,Positive,0.1416666666666667,Positive,-0.3903860449790954,Negative
"Ken makes a good point about that Ken doll, the journey isn't the good part, it's the real issue why people don't wanna workout.",0.1265,Positive,0.5333333333333333,Positive,0.3904989063739776,Positive
"bruh ALL of these people looked beautiful before, i'm so sad",-0.0236,Neutral,0.175,Positive,-0.5532533526420593,Negative
WHERES BEASTMASTER64,0.0,Neutral,0.0,Neutral,0.4056323766708374,Positive
This is what's privately known as 'the air pump' method  8:18 -,0.0,Neutral,0.0,Neutral,0.2555495202541351,Neutral
dude the first girl was SO PRETTY before 😔😔😔,0.8681,Positive,0.25,Positive,-0.2691317796707153,Negative
pewdiepie and Ken child support is what goes to the kids. Alimony is what he pays her okay she's getting that money to take care of herself.,0.7783,Positive,0.5,Positive,0.550000786781311,Positive
The last woman injected herself with cooking oil btw,0.0,Neutral,0.0,Neutral,-0.3144020140171051,Negative
Ps: don’t watch while eating bros*,0.0,Neutral,0.0,Neutral,-0.5234422087669373,Negative
Didn’t the guy who wanted to be a ken doll die?? Or was that someone else?,-0.6641,Negative,0.0,Neutral,-0.4300148785114288,Negative
Edgar is probably one of the cutest dogs I've ever laid my eyes on.,0.5859,Positive,0.0,Neutral,0.7464860677719116,Positive
wow hearing I'm beautiful from pewds is like way better than from anyone else,0.9201,Positive,0.4833333333333333,Positive,0.853273868560791,Positive
Nerd with glasses is a communist,-0.296,Negative,0.0,Neutral,-0.4825587272644043,Negative
Hi,0.0,Neutral,0.0,Neutral,0.2364865690469741,Neutral
"People seeking multiple plastic surgery procedures should instead be referred to a psychologist to evaluate their mental and emotional fitness as well as uncover why they feel they need all these different surgeries.

But strongly believe that there should be a legal limit to the amount of plastic surgery that can be done to a human being and that anyone who wants to treat plastic surgery like a yearly check up needs a psych evaluation more than they need to modification.
All of these stories are sad because these people felt they had to mutilate themselves to achieve beauty.",0.928,Positive,0.0733333333333333,Positive,-0.4685552418231964,Negative
Not me wondering why can't I find Oli London in the video,0.0,Neutral,0.0,Neutral,-0.3562334477901459,Negative
Surprised Donatella Versace wasn't in there😳,0.2263,Positive,0.1,Positive,0.2894102931022644,Neutral
Yikes,0.0,Neutral,0.0,Neutral,0.2450099289417266,Neutral
ALRIGHT PEWDIEPIE GOT MY ATTENTION AGAIN,0.25,Positive,0.0,Neutral,0.5060411691665649,Positive
That cat lady gave me the jumpscare of my life,0.0,Neutral,0.0,Neutral,0.6858910918235779,Positive
"I totally agree, what entitles that woman to $100 million of his money?  Why does Alimony scale with the man's wealth so dramatically? This is pure inequality.   So he can support her for life, but she doesn't have to contribute shit to the baby?  God damn misandry folks",-0.6664,Negative,0.0047619047619047,Positive,-0.7908595204353333,Negative
"The saddest part is that for every doctor that says no, there's another, far less qualified one, that will say yes.",-0.3182,Negative,-0.0333333333333333,Negative,-0.4582877457141876,Negative
"Theres 1 thing we can all agree of, when you get older, those implant of yours will fuck you up hard",-0.34,Negative,-0.175,Negative,-0.3001516461372375,Negative
Plastic surgery is often a way to flex how affluent you are.,0.0,Neutral,0.6499999999999999,Positive,0.3307919800281524,Positive
These body modification are so cringe,0.0,Neutral,0.0,Neutral,-0.47503262758255,Negative
Sounds like these two need a quick rundown on the Bogdanoffs.,0.3612,Positive,0.3333333333333333,Positive,0.3029516339302063,Neutral
Please polish my bald head.,0.3182,Positive,0.0,Neutral,0.2645341753959656,Neutral
"I remember when the Try Guys 'tried' plastic surgery (not really) and Eugene (the one known for his insanely good looks, competitive and overaciever-persona) was listing off all the things that were 'wrong' to him. The doctor disagreed and said there wasn't really anything to change, maybe a rhinoplasty procedure to lower the nose bridge. Eugene listed off his forehead, his chin, his eyes, his nose, etc. 

I agree I think there should be some sort of screening procedure implemented somewhere in this system of plastic surgery procedures.",-0.128,Negative,0.075,Positive,-0.4244633615016937,Negative
"Even though I will not be using Nord vpn, I cannot skip the ad because of Edgar.",0.0,Neutral,0.0,Neutral,-0.3330560624599457,Negative
"""Love yourself"" and ""it's about the journey""... wise words from PewDiePie!",0.8221,Positive,0.6875,Positive,0.5867733359336853,Positive
In the last one is not the doctor's fault. They said we will not do it anymore. So she inyecyed her face with cooking all every day. And she inyected like one litre or something.,0.5801,Positive,0.0,Neutral,-0.3760904967784881,Negative
"I’m curious - what charities have you donated to in the past number of months from youtube floorgang member proceeds? Also, do you still do livestreams?",0.7319,Positive,-0.175,Negative,-0.3601095974445343,Negative
8/10,0.0,Neutral,0.0,Neutral,0.3642940521240234,Positive
"Where does the organs go you ask?
They packed their bags, said ""Damn it this place, its impossible to live here"" and left",-0.4019,Negative,-0.1767676767676767,Negative,-0.7896751165390015,Negative
"No kid needs even like .... several thousands a month to live a good, healthy and entertaining, educated life. Alimony is a scam, thats  the best description for it.  One of the reasons ill never marry, or put up a contract to prevent getting ripped off in the worst case.",0.3612,Positive,0.1670454545454545,Positive,0.2669280469417572,Neutral
Wasn't he supposed to upload the Community idea video when this was uploaded?,0.0,Neutral,0.0,Neutral,-0.4137021899223327,Negative
"Pewds looking too good lately, what's up with that??",0.504,Positive,0.1999999999999999,Positive,-0.4349195957183838,Negative
"As someone recovering from an eating disorder and body dysmorphia, Felix is hitting the nail on the head here. If I let my an*rexia do to me what these doctors do to these people, I’d be put back in the pysc ward, with good reason. These people sre severley ill, and it’s insane that people make money off them like this.",-0.4215,Negative,-0.2,Negative,-0.6620849370956421,Negative
"I am actually jealous of his jaw surgery, I've had untreated TMJ for years because my insurance won't cover treatment :( I need halp, I literally have to talk for 20 minutes or less every day. It's limited my ability to get a job, it really is just horrible :'(",-0.7996,Negative,-0.3982993197278911,Negative,-0.7257722616195679,Negative
"damn ken, that base 2:40",-0.4019,Negative,-0.8,Negative,-0.3641465306282043,Negative
"what about ""Black alien""?  who cut off his fingers to have alien hands xD",0.4019,Positive,-0.2222222222222222,Negative,-0.502407968044281,Negative
Ken’s pink headphone ears are the ultimate in cringe,0.0,Neutral,-0.05,Negative,0.7194170355796814,Positive
2:40 ken bass drop,-0.2732,Negative,-0.15,Negative,-0.3533235788345337,Negative
The human ken doll is gonna start melting in the sun,0.0,Neutral,0.0,Neutral,-0.3449623584747314,Negative
"Bro, people have fake muscles to flex with them. That's the weakest shit. I mean do what ever you wanna do with your body, but common. Imagine, someone asking , ""yo can u help me lift that, and u  can't  even open a bag of chips. Bruh",-0.2382,Negative,-0.2625,Negative,-0.5314933657646179,Negative
As soon as Ken said Animorphs my heart exploded,0.6369,Positive,0.0,Neutral,-0.5433843731880188,Negative
11:14 that kind of looks like the dad of okuyasu,0.3612,Positive,0.6,Positive,0.3718707263469696,Positive
i couldve watched 2 more hours of this,0.0,Neutral,0.5,Positive,-0.3872970938682556,Negative
Dosadan si dobio si 110 000 000 na ništa,-0.3182,Negative,-1.0,Negative,-0.4825306534767151,Negative
Use me as a dislike button,-0.3818,Negative,0.0,Neutral,-0.2548972070217132,Negative
"2:27 not sad, not impressive, but depressing..",0.6349,Positive,-0.2833333333333333,Negative,-0.491356611251831,Negative
the first girl is built like a total drama character,0.3612,Positive,0.125,Positive,-0.3485448062419891,Negative
DON'T REMOVE YOUR FUCKING RIBS!!!!!!! 😨,-0.7463,Negative,-1.0,Negative,-0.9032558798789978,Negative
"Yay! Pewdiepie video!!
*sees ken*
*sigh* *clicks off*",0.6571,Positive,0.0,Neutral,-0.4905822873115539,Negative
???,0.0,Neutral,0.0,Neutral,-0.4228846430778503,Negative
Why's there like 9000 bots on the comment section now? Wtf is YouTube doing aside from exploiting their creators???,-0.7319,Negative,-0.5,Negative,-0.5196177363395691,Negative
"if a women bears your children and because of that has to leave work or work part-time and looses career options because of it, then yes you need to compensate her for that if you divorce.",0.2263,Positive,0.0,Neutral,-0.4679231941699981,Negative
Imagine gaining weight with fake muscle implants,-0.0772,Negative,-0.5,Negative,-0.3871791958808899,Negative
the idea about alimony is that the child's life standards shouldn't change due to the divorce,0.0,Neutral,-0.125,Negative,0.3104904592037201,Neutral
PooooOOOOooooOOOoooing PIE!!!!!!!,0.0,Neutral,0.0,Neutral,-0.3909724056720733,Negative
The first girl is Swedish!,0.0,Neutral,0.3125,Positive,-0.2843397259712219,Negative
😂😂😂😂😂,0.926,Positive,0.0,Neutral,0.3085779249668121,Neutral
Edgar just looks like he doesn’t want to be there.,0.4215,Positive,0.0,Neutral,-0.3173978924751282,Negative
This video isn't complete without oli london,0.0,Neutral,0.1,Positive,-0.6836286783218384,Negative
I LOVE THIS SOULMATE DUO SOOOO MUCH,0.8697,Positive,0.35,Positive,0.8002372980117798,Positive
7:08 explicit content,0.0,Neutral,0.0,Neutral,0.2478894591331482,Neutral
So I guess this isn't gonna be one of those videos that I can watch while eating....,0.0,Neutral,0.0,Neutral,0.4098701477050781,Positive
"You can tell that lady would have still looked beautiful even if she was aging naturally, you could just tell. It's crazy when people get so crazy that they can't see they're already beautiful but in pursuit of beauty make themselves ugly.",0.4389,Positive,-0.0166666666666666,Negative,-0.3061246871948242,Negative
pewds and ken gymbros???,0.0,Neutral,0.0,Neutral,-0.3784820139408111,Negative
Just wait till they’re old,0.0,Neutral,0.1,Positive,0.372475802898407,Positive
pewdiepie is overrated my content is better,0.4404,Positive,0.5,Positive,-0.5229448080062866,Negative
