Comment,Vader score,Vader label,TextBlob score,TextBlob label,BERT score,BERT label
PewDiePie sounding like the sarduakar in the beginning.,0.3612,Positive,0.0,Neutral,0.3100509941577911,Neutral
I just want to fucking throw my phone because he keeps pausing the video,0.0772,Positive,-0.6,Negative,-0.552518904209137,Negative
"that guy looks like a kiddy toucher, FBI beware",0.3612,Positive,0.0,Neutral,-0.6753315925598145,Negative
It is very stupid to do unnecessary plastic surgery for anyone!,-0.6105,Negative,-0.75,Negative,-0.8930160403251648,Negative
Mr when,0.0,Neutral,0.0,Neutral,0.2853760421276092,Neutral
In the case of where do the organs go...?!? They do get pushed around like if u were pregnant.... But they go up AND down with the corset. Picture in ur head where the slimmest part on the corset is ur intestines in a single file instead of curled up. So top half curled up then a stretched out part then curled up at the bottom again.,0.6653,Positive,0.0649470899470899,Positive,-0.39695805311203,Negative
"On the surgeon side of things, most surgeons probably don't know that they've had that many surgeries especially at first (as it becomes more obvious later on) because they just keep going to different ones...",0.0,Neutral,0.2857142857142857,Positive,0.5091533064842224,Positive
can u stop making videos with this dude he is annoying,-0.5994,Negative,-0.8,Negative,-0.5660820603370667,Negative
love this video,0.6369,Positive,0.5,Positive,0.8700463771820068,Positive
Edgar looks so done,0.0,Neutral,0.0,Neutral,0.4347312748432159,Positive
Wish I could get famous for just re acting to videos… no what I will wish me luck,0.7351,Positive,0.25,Positive,-0.3259830176830292,Negative
stop by my channel,-0.296,Negative,0.0,Neutral,-0.5416955947875977,Negative
That horrific timelapse of the chick with the billionaire husband looks like scrolling through Oblivion face presets.,-0.4404,Negative,-1.0,Negative,-0.6677919030189514,Negative
8:28 all the shogun wanted was a haircut,0.0,Neutral,0.0,Neutral,-0.2593265175819397,Negative
Ken would look super attractive bald. Just saying.,0.7783,Positive,0.5666666666666667,Positive,0.2885465025901794,Neutral
Wow pewdiepie is so smart. Just have Edgar in your lap while he does the sponsor so people actually watch it,0.8069,Positive,0.1047619047619047,Positive,0.8271220326423645,Positive
"I was not ready for ""outside the body in a bag"". 😂😂😂😂",0.8587,Positive,-0.05,Negative,-0.4071836471557617,Negative
"Yo, 12:00 to 12:23 without context legit sounds a helllll of a lot like discourse regarding transgender surgeries.",0.3612,Positive,0.0,Neutral,-0.5562566518783569,Negative
Edgar is the cutest dog in the world and the fact that his name is Edgar … too much for me man,0.5859,Positive,0.2,Positive,0.2709597051143646,Neutral
Edgar literally has no idea wtf is going on and I love it,0.7246,Positive,0.0,Neutral,0.7368277907371521,Positive
im so against people doing any surgeries like these. People need to understand that this is so unhealthy mentally and that it ruins the child at hard. You are literally telling yourself that you arent good enough. The fact that we are even alive speaks wonders of how beautiful people are.,-0.2668,Negative,0.0885416666666666,Positive,-0.6667952537536621,Negative
"""Is it sad or is it impressive?""",0.0516,Positive,0.25,Positive,0.3602341413497925,Positive
The dude looks like next generation NPC 😂,0.6597,Positive,0.0,Neutral,0.2691358923912048,Neutral
I workout to stay healthy.,0.4019,Positive,0.5,Positive,0.46040740609169,Positive
0:00 AHAHAHAH HE MADE THE SOUND FROM DUNE,0.0,Neutral,0.4,Positive,-0.4968816339969635,Negative
Uuuuuj,0.0,Neutral,0.0,Neutral,-0.2198752611875534,Negative
I am trying so hard not to throw up watching this video.,-0.2183,Negative,-0.2916666666666667,Negative,-0.4203994572162628,Negative
Save Myanmar.,0.4939,Positive,0.0,Neutral,-0.3319688439369201,Negative
This video was great.  These two should make a podcast.,0.6249,Positive,0.8,Positive,0.6906012892723083,Positive
She became a caveman. A booga boo haha,0.4588,Positive,0.2,Positive,-0.3592503666877746,Negative
petition to make a whole vid with edgar,0.0,Neutral,0.2,Positive,0.2740560472011566,Neutral
As someone that wants to get a few things done i am now panicking 😭,-0.7184,Negative,0.0,Neutral,-0.3695888519287109,Negative
Ok. I can't watch this.,0.0,Neutral,0.0,Neutral,0.6490023732185364,Positive
"So many people say ""let people do what they want, its their own body"", yea like you can go & lay flat on a highway too, its your body, but what will laying flat on a highway do? You should actually get some help from a psychologist, to figure out why you actually want to ""go and lie down on a highway"". Not everything our brain says is right. It processes emotions differently.
Also, those who are thinking about having one, watch Dr. Anthony Youn's videos, his videos are extremely informative (he is a holistic plastic surgeon and he always says “always consider surgery as a last resort"")",0.7096,Positive,0.0959235209235209,Positive,-0.3887681663036346,Negative
Why isn't Jessica Alves on here?,0.0,Neutral,0.0,Neutral,-0.4114857614040375,Negative
Kaaahahahaha that exchange at start is awesome xD,0.836,Positive,1.0,Positive,0.6207937002182007,Positive
"If you are goint through any problem in life whichi is taking you
I please you to come is islam
I am not telling you to come and accept 
Give a little bit of time on recharching islam
Inshallah your life will change.",0.296,Positive,-0.1875,Negative,0.2618421614170074,Neutral
"F should warning us first, category disturbing pictures, anyway good content Felix.",-0.4215,Negative,0.15,Positive,0.4105578064918518,Positive
"is that meat canyon reference
??",0.0,Neutral,0.0,Neutral,-0.2879162430763244,Negative
I understand why doctors get paid so much cause doing surgery’s like these are ridiculous,0.0,Neutral,-0.0666666666666666,Negative,-0.7766931056976318,Negative
"10:18 - alimony isn't child support - in many places it's literally life long servitude to your ex because ""if you were supporting them and you were still together, you'd be spending this much on them""... which makes no sense because... you're not together anymore. It's like ""hey this person's a massive financial drain and I don't like them"" ""too bad sucker, pay up for life""",-0.816,Negative,-0.0124999999999999,Negative,-0.6468001008033752,Negative
"These aren't the worst, the worst are the ones that died.",-0.6604,Negative,-1.0,Negative,-0.7783761024475098,Negative
"someone arrest that doctor for agreeing to remove not 2, but 6 of a person's ribs. That can't be medically advisable.",0.0,Neutral,-0.025,Negative,-0.531293511390686,Negative
"(9:45) The thought about alimony is good; based on that one partner is dependent on the other but must still have the security of separating and still being supported for a bit. – However, how they calculate it is crazy:
1. Just because the ex-partner is rich, doesn't mean the other person _needs_ to get paid a lot of money.
2. Sometimes the ex-partner has to pay out so much they themselves gets bankrupt, still resulting in a person becoming bankrupt out of the divorce anyway.",-0.3818,Negative,0.0703125,Positive,0.4061554074287414,Positive
".........................................................................................................................................................,..............................................................................................................................................................................................................................









































































































































































































..,.",0.0,Neutral,0.0,Neutral,-0.2153901308774948,Negative
they definitely live in the Silicon valley,0.4019,Positive,0.1363636363636363,Positive,0.4111612439155578,Positive
"You are beautiful the way you are ❤️❤️❤️ uWu 
-Most handsome guy in 2020",0.8122,Positive,0.6166666666666667,Positive,0.9102574586868286,Positive
Honestly couldn’t eat watching this,0.4588,Positive,0.6,Positive,-0.6057758331298828,Negative
I think the ken doll is now a women!! Am I wrong? I swear I saw it!,-0.6341,Negative,-0.625,Negative,-0.3914363086223602,Negative
"it s not the doctor bussines to tell you what is good and what is bad in plastic, he tells  you once, you sign that you are agreed and that s it, and that surgeris aren t in public hospitals!",0.2003,Positive,3.700743415417188e-17,Positive,-0.5260615348815918,Negative
"Lol you really think this is the first time the doctors are mentioned? The thing is, these people came to the doctors, they know and were told the risks and they came back even after knowing the result. And with the PC culture, it's even harder to deny their requests. The procedures exist and the results are not intended to look like that. The patients came back again and again, and that's why they look like that and why they pay that amount.",0.4404,Positive,0.1916666666666666,Positive,-0.4490525424480438,Negative
"I work out to defend myself ;-; 

I think physical appearance is second..",0.0,Neutral,0.0,Neutral,0.3684839010238647,Positive
I believed what  pewdiepie  believe I see this shit it hurts really . When you do this your internal beauty dies,-0.5499,Negative,0.0,Neutral,-0.59116131067276,Negative
That first lady totally watches one piece.,0.0,Neutral,0.125,Positive,0.7040293216705322,Positive
But plastic implants look shit though,-0.7096,Negative,-0.2,Negative,0.4698100984096527,Positive
i came to see oli london,0.0,Neutral,0.0,Neutral,0.2483971416950225,Neutral
Didn’t Justin end up being trans?,0.0,Neutral,0.0,Neutral,-0.3502986133098602,Negative
just one thing that bugs me. even vpn have to save your logs. because of laws for digital crimes and more. so it is a lie with no logs policy. it woul be totaly ilegal in the most countries.,-0.4391,Negative,0.125,Positive,-0.9039868116378784,Negative
5:19 I 100% agree with pews on this one I ran every day for a month and yes it was hard but it helped me when you look in the mirror the next day and see how fit you became it is very motivational and makes you determined to keep going,0.8294,Positive,0.0770833333333333,Positive,0.5658403635025024,Positive
I just can't believe Edgar STILL hasn't gotten NordVPN yet 🙄 pshh bruh the links in the description,0.0,Neutral,0.0,Neutral,-0.3287623524665832,Negative
Did Felix just say you are Pewdiful?,0.0,Neutral,0.0,Neutral,-0.3602637052536011,Negative
Edgar so old but still adorable,0.6486,Positive,0.3,Positive,0.5433839559555054,Positive
"so is the human ken doll like, smooth down there?",0.3612,Positive,0.0814814814814814,Positive,0.4099352359771728,Positive
Do muscle implants pop when you start actually working out?,0.0,Neutral,0.0,Neutral,-0.359557569026947,Negative
Haven’t watched in a while. You guys look old😂,0.4404,Positive,0.0,Neutral,0.2791267335414886,Neutral
lol pewds should look at his botched wife as well ...,0.5994,Positive,0.8,Positive,0.3238292932510376,Neutral
"Well about the working out to look good Vs  to be stronger- I often have this issue as a swimmer I need arm muscles but also the muscles on the underside or your arm. Also for me personally I am faster when very slightly ""over weight"" in the lower stomach area (but still have to have strong abs/core) so basically I spend hours each day to do all the work but still don't get to look good",0.8689,Positive,0.3233333333333333,Positive,0.4737285077571869,Positive
"Ken wearing flannel looks like the guys from that tik tok “You ever been whipped by a wet spaghetti noodle by your girlfriends sister because you got confused and f***** her dad, well that’s how it feels to drive a Ford F-250”

I was just trying to be goofy no hate ☺️ I didn’t realize how serious this video kind of was. I feel sorry for all of those poor people. I’ve always wanted to get a nose job & lip fillers but too nervous it would make me look fake or more messed up looking than how I naturally look",-0.8952,Negative,-0.0121212121212121,Negative,-0.5482034683227539,Negative
Look at all those handsome squidwards,0.4939,Positive,0.5,Positive,0.5139279961585999,Positive
"working out to look good is pathetic, you're still doing it for strangers approval",0.3182,Positive,-0.15,Negative,-0.3942737579345703,Negative
When he talked sardaukar in the beginning😂😂😭,0.4019,Positive,0.0,Neutral,-0.2149041891098022,Negative
I feel you Ken,0.0,Neutral,0.0,Neutral,0.3960453867912292,Positive
"I feel so bad for some of these people. Some of these people probably had really bad body dysmorphia, so bad to the point where they had to do this. Especially the last girl.",-0.9297,Negative,-0.4199999999999999,Negative,-0.4993132352828979,Negative
"pewds: you like anime right?
edgar: o-o",0.3612,Positive,0.2857142857142857,Positive,-0.3280345797538757,Negative
I think yes,0.4019,Positive,0.0,Neutral,0.3192754983901977,Neutral
Okay but using Edgar while giving the ad is genius no offense pewds but I usually skip through the ads. But I can't skip pass Edgar 🥰🥰🥰😍😍😍,0.9944,Positive,0.125,Positive,0.7962262034416199,Positive
1:49 made me feel sick. 6 ribs removed wtf,-0.7964,Negative,-0.6071428571428572,Negative,-0.7670440673828125,Negative
Does anybody else feel like pewds is doing too many collabs with Ken...? It's kinda boring :(,-0.2798,Negative,-0.4166666666666667,Negative,-0.4653400182723999,Negative
"""I dont beep when i go thru airport security"" this should be on a shirt and given to everyone with piercings",0.34,Positive,0.0,Neutral,-0.3604084253311157,Negative
"Blinded by greed and obsession then suffering its consequences is one of many ways we truly learn from ourselves how horrible and stupid we were. A sad reality, but a reality that we should face so that we don't continue living with a harmful mindset. So we should learn from these people to know when to stop and to not pursue another goal and become overly ambitious, rather stick with what we have already accomplished and settle a new life in it while making smaller goals.",0.0644,Positive,-0.1517045454545454,Negative,-0.4603376090526581,Negative
pewdipie go buy DT 797 PV FOR MICROPHONE QUALITY,0.0,Neutral,0.0,Neutral,0.5373992919921875,Positive
Pewdipie if you see this pls make a video about t series hitting 200 million subs,0.3869,Positive,0.0,Neutral,-0.5443112254142761,Negative
"10:42 Alimony doesn't even have anything to do with children, it's simply because a man is expected to ensure his wife gets to keep her lifestyle after the divorce.",0.3818,Positive,-0.05,Negative,-0.2779675722122192,Negative
The problem is sense the doctors get money from it and get more rich they don't care about really helping you except for what you want Proven facts Pews,0.3309,Positive,0.3583333333333333,Positive,0.3384282290935516,Positive
Is this channel a joke?,0.296,Positive,0.0,Neutral,-0.8019803166389465,Negative
"The saddest part of all of this, is the sacrifice of health for asthetics :( Silicone sickness or BBI is a horrific condition that happens within and makes you sick slowly as your body slowly tries to eat away the silicone becuase it's a foreign body within your system. If anyone feels they need to have plastic surgery, please do your research for long term effects before commiting! Is it worth it? :)",-0.8655,Negative,-0.2501984126984127,Negative,-0.5802184343338013,Negative
Don’t say doctors because it can be confusing. Plastic surgeons are going to far. Doctors do health not fake muscle implants.,0.1665,Positive,0.0166666666666666,Positive,0.3061917722225189,Neutral
the asian girl looks like the witch from the waste from howls moving castle,-0.4215,Negative,-0.1,Negative,0.2282440960407257,Neutral
3:11 how does her entire body look lopsided?,0.0,Neutral,0.0,Neutral,-0.3309406340122223,Negative
People are more into transforming themselves than improving themselves. Its superficial and temporary.,0.4215,Positive,0.5,Positive,-0.4926891326904297,Negative
"0:03 Pewds, you talk more and more like an old swedish man xD",0.8676,Positive,0.3666666666666667,Positive,-0.49654021859169,Negative
I like if they also add Oli London in this video...,0.3612,Positive,0.0,Neutral,0.3828544020652771,Positive
"*”We’re evolving, just backwards.”*",0.0,Neutral,0.0,Neutral,0.2962572872638702,Neutral
"I need to work out because I play rubgy, if you're not fit you will get injuries... Jk I wanna look good",0.3378,Positive,0.2499999999999999,Positive,0.3632185161113739,Positive
justin looks like a real sim character,0.3612,Positive,0.2,Positive,0.2811453938484192,Neutral
Bro this was probably the scariest video i've ever seen!,0.0,Neutral,0.0,Neutral,-0.7574582099914551,Negative
w/l? I think it's definitely a win,0.7579,Positive,0.8,Positive,0.4117021262645721,Positive
Wait why did Ken have jaw surgery did he break it really bad? I had to have surgery on my after I wrecked my 4 wheeler and broke my nose had to have surgery on it too shit sucked,-0.9216,Negative,-0.4499999999999999,Negative,-0.6779891848564148,Negative
"Love how Ken challenged Pewds philosophy. More people should do this, because most of it is complete bs",0.5859,Positive,0.4,Positive,0.7008198499679565,Positive
Yo for the first clip.......... I don't care if you guys will call me a simp but I LOVE THOSE OPPAI,0.7956,Positive,0.375,Positive,0.4513191282749176,Positive
Pixie has the body type of all girls on one piece.,0.0,Neutral,0.0,Neutral,0.3437914848327636,Positive
I'm not sure it is reputable surgeons doing this stuff. It's the back alley surgeons,-0.2411,Negative,0.0833333333333333,Positive,0.4423272907733917,Positive
Netflix has anti-vpn now not haram,0.0,Neutral,0.0,Neutral,-0.4548121392726898,Negative
The Asian lady injected some kind of product into her own face because the doctors refused to give her any more silicone injections (I think mayo or something?) really sad either way,-0.6801,Negative,0.24,Positive,-0.5039718747138977,Negative
please come back with brazilian subtitles🥺,0.3182,Positive,0.0,Neutral,-0.443677693605423,Negative
Alimony isn't for child support. He's literally just paying the woman. It's ridiculous. It's just an old timey law made because women found it harder to get jobs and make money back then. Women can get jobs today. Why do they need alimony??,-0.6271,Negative,-0.0833333333333333,Negative,-0.6695210337638855,Negative
"11:12 is wrong, i forgot the lady's name but the lady in the picture actually had illegal injections in her skin to make her more prettier,  part of her face contains cement and very bad chemicals i think (part is definitly filled with sement) im not sure what the name of the story is but you can find it on youtube, it should have her face up there.",-0.8748,Negative,-0.1799999999999999,Negative,-0.3998988270759582,Negative
10:00 that is a bit far I think lol,0.4215,Positive,0.45,Positive,0.3259700238704681,Neutral
"8:19 you're supposed to be able to tell, that is the goal, it is supposed to look like a plastic doll",0.3612,Positive,0.5,Positive,-0.2971459031105041,Negative
"2:12 it is a bit of a pose, but some ppl pose like that",0.5023,Positive,0.0,Neutral,0.4453786611557007,Positive
Thank you pewds now I’m rethinking the bbl,0.3612,Positive,0.0,Neutral,0.2921393811702728,Neutral
DUUUUMB WAYS TO DIEEEE SO MANY DUMB WAYS TO DIIEEE,-0.8952,Negative,-0.0833333333333333,Negative,-0.6905616521835327,Negative
BORING,-0.3182,Negative,-1.0,Negative,-0.4912548661231994,Negative
Waist that small is so dumb bc how tf are you going to eat??? Like you gotta eat liquids or something bc the poo can’t get thru lmao,0.4017,Positive,-0.0083333333333333,Negative,-0.5622977018356323,Negative
Ay i thought ken was dead?,-0.6486,Negative,-0.2,Negative,-0.3442199230194092,Negative
"Rodrigo Alves (the human ken doll) transitioned last year, and is now Jessica Alves. And yes, more plastic surgery for the transition, obviously.",0.4019,Positive,0.125,Positive,0.375308096408844,Positive
"Pewdiepie was in my Spotify wrapped, and I am proud",0.4767,Positive,0.8,Positive,0.7471104264259338,Positive
lordy,0.0,Neutral,0.0,Neutral,0.3701258599758148,Positive
1:40 we found our cast for the one piece live action,0.0,Neutral,0.1181818181818181,Positive,0.3069287836551666,Neutral
I feel like his content is starting to get good again,0.6597,Positive,0.35,Positive,0.4952562749385834,Positive
Why does he suddenly have a lisp?,0.0,Neutral,0.0,Neutral,-0.306338369846344,Negative
I feel like instead of spending all that money on plastic surgery maybe spend it on some therapy first.,0.3612,Positive,0.25,Positive,-0.3633435666561126,Negative
its disappointing how oli is not here,-0.4939,Negative,-0.6,Negative,-0.4379434585571289,Negative
Pew Die Pie💗💗💗,0.9493,Positive,0.0,Neutral,0.3426272869110107,Positive
Pls try pubgm,0.0772,Positive,0.0,Neutral,0.251335084438324,Neutral
That ain’t ken that’s kim,0.0,Neutral,0.0,Neutral,-0.2817511260509491,Negative
Pooperpie,0.0,Neutral,0.0,Neutral,0.2556013762950897,Neutral
She was like beyblade evolutiooon (beyblade doesnt make sense but who cares),0.6956,Positive,0.0,Neutral,0.3191778659820556,Neutral
Remember you’re pewdiful just the way you are 💕✨,0.765,Positive,0.0,Neutral,0.6470813155174255,Positive
"I don’t know if they watched the last one all the way, but the model’s face swelled up permanently like that from self injecting cooking oil into her face; this was not caused by the doctors but unfortunately from the oil she used.",0.0387,Neutral,-0.25,Negative,-0.4156585931777954,Negative
Woah woah 110m subscribers!,0.0,Neutral,0.0,Neutral,-0.5445992946624756,Negative
Alimony and child support are totally different things....,0.4019,Positive,0.0,Neutral,-0.2697259187698364,Negative
"Virgin ""Cosmetic beauty"" vs Chad self love",0.8402,Positive,0.5,Positive,0.495413213968277,Positive
"If it seems too good to be true it's probably too good to be true, and plastic surgery is false way to achieve beauty. You are already beautiful.",0.959,Positive,0.4249999999999999,Positive,0.5243812203407288,Positive
8:11 to 8:30 reverse human evolution,0.0,Neutral,0.0,Neutral,-0.3511363565921783,Negative
Damn Edgard Looks so old now,-0.4019,Negative,0.1,Positive,-0.3880888819694519,Negative
"Just wanna point out, Pewds and his friend posted this vid wildly disrespecting the Bogdanoffs 4 days ago-- not even knowing who they are for goodness sake-- and look at the markets today.",0.7351,Positive,0.1,Positive,-0.5144160389900208,Negative
Edgar 👋👋,0.7506,Positive,0.0,Neutral,0.3480609357357025,Positive
LOVE YOU PEWDIEPIE 👊👊,0.7125,Positive,0.5,Positive,0.7429332733154297,Positive
b,0.0,Neutral,0.0,Neutral,0.2911197245121002,Neutral
This video is so hard to get through without feeling sick to my stomach this is my body horror nightmare and i wish everyone on this earth a very love yourself as you are,0.6071,Positive,-0.1186507936507936,Negative,-0.5156073570251465,Negative
Gak bisa bahasa Inggris,0.0,Neutral,0.0,Neutral,0.3250221014022827,Neutral
"Trust me, when they say to be you they mean it.",0.5106,Positive,-0.3125,Negative,0.5433356165885925,Positive
I already have Nord VPN but i still watched because of Edgar,0.0,Neutral,0.0,Neutral,0.3039817810058594,Neutral
Love the reaction face on thumbnail,0.6369,Positive,0.5,Positive,0.6170626878738403,Positive
Sidemen reacted to the exact same video some time ago,0.0,Neutral,0.125,Positive,-0.2938585877418518,Negative
"Edgar the black pug looked Soo cute in the ad, and how Felix asked Edgar, you like anime right Edgar? 😆",0.7906,Positive,0.2063492063492063,Positive,0.2530525624752044,Neutral
It was very sad to see what happened to them... Especially the last person... That was pretty reasonable how Felix said the doctors are abusing mentally ill people...,-0.7178,Negative,-0.1166666666666666,Negative,-0.4464644491672516,Negative
"I've always hated plastic surgery, but I could never lay my finger on why that is. And it's not just for the people who took it too far, it's also people who do just a nose job or just an eyelid surgery ( Although, when it is to fix some actual deformity/ a wound, I don't find it repulsive.)
But after watching this and thinking about it for a bit, I think I know why it is. I like nature. I like animals and plants and how everything is different and unique. I can find something with imperfect features to be perfectly flawed and beautiful. I would always prefer a real plant over a fake plant made of plastic. And to me, that's what you are if you did lots of plastic surgery. You disrespected nature. You spatt on all of your ancestors. You became perfect, and thus, destroyed all of your unique beauty.

That's how I feel. I'm glad I finally realized why that is. Thanks pewds :)",0.9666,Positive,0.1466666666666666,Positive,0.5470776557922363,Positive
"I love it when the notification shows up ""someone like your comment"" and ""you have new subscriber""",0.7717,Positive,0.3181818181818182,Positive,0.6098673343658447,Positive
thats a very smart way of making me not skip an ad 🐶,0.4576,Positive,0.2785714285714286,Positive,0.3910215497016907,Positive
Pewdiepies a Scorpio so I let his quick overly solid opinions slide a lot but it’s always refreshing how ken keeps his mind open still and provides other outlooks to a situation. He’s a good kind man!,0.8762,Positive,0.3083333333333333,Positive,0.6802771687507629,Positive
Ken you dont need surgery both me and my partner agree you’re a DILF,0.3612,Positive,0.0,Neutral,-0.3544577360153198,Negative
I LOVE PEWDIEPIE but tbh his views really dropped but he still is SUPER FUNNY,0.9466,Positive,0.3208333333333333,Positive,0.5015215873718262,Positive
