Comment,Vader score,Vader label,TextBlob score,TextBlob label,BERT score,BERT label
who needs hiding places when you’ve got speed-markipler,-0.296,Negative,0.0,Neutral,0.2909318804740906,Neutral
"13:53

Freddy:I feel you are BROKEN

Me:Gregory is so emo💀😢He is soo quirky💅

[Drop your memes at the replies]",-0.8518,Negative,-0.4,Negative,-0.3848300576210022,Negative
what,0.0,Neutral,0.0,Neutral,0.2179408073425293,Neutral
"*Monty wrecking up his room*
Mark: Someone is taking a dump.
*Noises get louder.*
Mark: Someone’s taking an aggressive and violent dump.
*Noises are going to the max volume.*
Mark: Someone is taking a murderously intense dump.",-0.9442,Negative,-0.3,Negative,-0.4930054545402527,Negative
8:17 I thought it might switch to poppy playtime and Huggy Wuggy would appear.,0.0,Neutral,0.0,Neutral,-0.3320946395397186,Negative
34:18,0.0,Neutral,0.0,Neutral,-0.2157156318426132,Negative
This was probably my favorite series hes ever made,0.4588,Positive,0.5,Positive,0.8589988946914673,Positive
What happens if I told you this song was playing in my gym I'm not sure it was this all but sounded a lot like it,0.4886,Positive,-0.25,Negative,0.3099506497383117,Neutral
this was a day before my birthday wow,0.5859,Positive,0.1,Neutral,0.7285835146903992,Positive
because bonnie was on a major killing spree and thats why there is no bunny in the pizzaplex,-0.7841,Negative,0.0625,Neutral,0.2653785347938537,Neutral
chica has pink mustache,0.0,Neutral,-0.1,Negative,-0.2801192998886108,Negative
did u say the a word ?,0.0,Neutral,0.0,Neutral,-0.2897302210330963,Negative
Tnagn,0.0,Neutral,0.0,Neutral,0.2489114850759506,Neutral
roxy is cringe,0.0,Neutral,0.0,Neutral,-0.3327321112155914,Negative
this is what I would say about roxy,0.0,Neutral,0.0,Neutral,0.5204684138298035,Positive
What is with this guy and saying chew my bones,0.0,Neutral,0.0,Neutral,0.5638195872306824,Positive
Markiplier I rly love your videos I hope ull get very popular! Please make more I really love your videos! I keep repeating everything:/ but still I love ur video's. Please make more! Bye,0.964,Positive,0.6208333333333333,Positive,0.6763373613357544,Positive
"his welcome back to fnaf,shows the expression how much times he already played fnaf and hes going to play again. just a theory",0.7783,Positive,0.3333333333333333,Positive,0.4000231325626373,Positive
"rewatching this just to hear mark go ""wow"" at the intro again because it makes my heart smile 0:45",0.8885,Positive,0.2,Neutral,0.3455130755901336,Positive
NaUgHtY BOi👹,0.0,Neutral,-0.15,Negative,-0.5083063840866089,Negative
I LOVE the suite ???☠️!,0.776,Positive,0.625,Positive,0.2442348748445511,Neutral
Someone edit mark saying “yeah you right” to that one doja cat song lmao,0.5994,Positive,0.4428571428571428,Positive,-0.4778863191604614,Negative
Oh wow they took Alien Isolations save system.,0.7579,Positive,-0.075,Negative,-0.5996223092079163,Negative
My favourite Minnie says well yeah I'm at the main entrance but there's nothing there this chica why you do this okay I'm not doing with this thing mrs. See why I don't play it,0.3146,Positive,0.3333333333333333,Positive,0.3313632309436798,Positive
"""Alert: Delicious frontal lobes detected!""
That killed me.",0.1759,Positive,0.4,Positive,-0.5246179699897766,Negative
It’s so adorable how enchanted mark is at the opening cutscene 🤩,0.7474,Positive,0.5,Positive,0.8053154945373535,Positive
“Alert! Delicious frontal lobes detected!” This is now my new favorite quote,0.8065,Positive,0.5454545454545454,Positive,0.8874146342277527,Positive
faddy: oh umm vanessa i'm a girl  vanessa:.....,0.0,Neutral,0.0,Neutral,-0.3452221751213074,Negative
"Mark: Do I need to run? I am assuming I dont!
Monty: CMHERE KID!",0.0,Neutral,0.0,Neutral,-0.3180782496929168,Negative
Man it’s been 4 months since this game,0.0,Neutral,-0.4,Negative,0.2637300789356231,Neutral
"23:01 - 23:10
 that made me laugh so hard",0.4086,Positive,0.0041666666666666,Neutral,-0.38953897356987,Negative
in the daycare the wires had color.,0.0,Neutral,0.0,Neutral,0.3220341503620147,Neutral
hey mark when i played on that part trying to get the magnet i just sprinted,0.34,Positive,0.0,Neutral,-0.3896859884262085,Negative
At 25:35 monty looks like a weirdo,-0.0772,Negative,0.0,Neutral,0.2311264723539352,Neutral
"Markiplier: calls Chica dumb/stupid



Jacksepticeye: ""I have never been more horny for these animatronics""",0.0,Neutral,0.5,Positive,-0.7494794726371765,Negative
Man speed ran the stairs,0.0,Neutral,0.0,Neutral,0.4030939638614654,Positive
how did you not see the rabbit?! that's spooky,0.0,Neutral,0.0,Neutral,-0.2809451520442962,Negative
"I'm late to this but I like what they did to FNAF franchise with this game. They changed up the formula but at the same time, there's still the base gameplay too. This makes me want to play it but I don't have the right stuff too. Unless it can be played on a switch lite",0.872,Positive,-0.2428571428571428,Negative,0.5234204530715942,Positive
theroy that micheal afton is freddy idk if thats true,0.34,Positive,0.35,Positive,-0.2897040247917175,Negative
rewatching this for the 2nd time i need the spooky-markiplier-comfort content,0.0,Neutral,0.0,Neutral,0.5558140277862549,Positive
"Imma just

* clears throat *

Subscribe real quick",0.0772,Positive,0.5,Positive,0.3372701704502105,Positive
"Markiplier: You'll never find me

Glamrock Chica: Are you sure about that?",0.3182,Positive,0.5,Positive,-0.3690853416919708,Negative
bro u can see like hints like when Gregory said i dont want to be crush and twisted into a meat pretzel its just like william stuffing kids into the suits,0.6886,Positive,-0.5,Negative,-0.2303812801837921,Negative
7:16 i didn't know animatronics could lie,0.0,Neutral,0.0,Neutral,0.2573716044425964,Neutral
DA BITE OF 87:V,0.0,Neutral,0.0,Neutral,-0.3624607622623443,Negative
Doing my first play through of Security Breach and dude this is hard so watching Mark so hopefully I can figure out what the heck I’m doing,0.784,Positive,-0.0208333333333333,Negative,0.2842356860637665,Neutral
Yeah fnaf security breach was more just plain cool than scary dispite being a fnaf game but still loved it lol,0.9007,Positive,0.1765306122448979,Neutral,0.3827954530715942,Positive
E,0.0,Neutral,0.0,Neutral,0.2746336758136749,Neutral
YOUR THE BEST,0.6369,Positive,1.0,Positive,0.9073998928070068,Positive
"Mark: knocks over cans
Chica: WHAT THE FUCK!?!?",-0.7333,Negative,-0.625,Negative,-0.7123688459396362,Negative
"my fav bits 
4:47
5:13 ( just his face here )
7:50
24:20
31:38 he gets into the daycare",0.4588,Positive,0.0,Neutral,0.3144285678863525,Neutral
42:56 “OMG HJBTGHA!”,0.0,Neutral,0.0,Neutral,-0.3344820141792297,Negative
Mark i love your voice,0.6369,Positive,0.5,Positive,0.7758533358573914,Positive
"basically, for Markiplier, almost everything is for nerds 🙃 Lovely french",0.5859,Positive,0.25,Neutral,0.4173565506935119,Positive
Aside from moon and sun the little caution signs are my favorites.,0.4215,Positive,-0.1875,Negative,0.5167061686515808,Positive
29:43,0.0,Neutral,0.0,Neutral,-0.2414959520101547,Negative
Moon is literally a flying fuck,-0.5423,Negative,-0.4,Negative,-0.739017903804779,Negative
7:16 fax,0.0,Neutral,0.0,Neutral,0.235808864235878,Neutral
When sundrop was turning into moondrop mark was like: uhhhhhh,0.3612,Positive,0.0,Neutral,-0.3536531329154968,Negative
I like the part where Chica is just rocking her Guitar she’s my favorite,0.6705,Positive,0.5,Positive,0.4949923157691955,Positive
16:56 Mark is now joey-,0.0,Neutral,0.0,Neutral,0.3135678172111511,Neutral
Sheesh Roxy,0.0,Neutral,0.0,Neutral,-0.2534649074077606,Negative
"Me: nodding
Mark: don’t agree with that",0.3612,Positive,0.0,Neutral,-0.4156422019004822,Negative
So I was just rewatching the curse of dreadbear videos and I saw when he won  the the trick or treat game mode it gave him a moon drop,0.1531,Positive,-0.4,Negative,-0.3240686357021332,Negative
Why can the animatronics move really fast but once you’re in the game play they move horribly?,-0.3612,Negative,-0.3999999999999999,Negative,-0.3931819200515747,Negative
"I'm wondering if no one noticed or not but, his laugh at the beginning of this video reminded me of Earnest, if you have no idea who that is either Google him or you're too young/didn't grow up with his t.v show/movies.",-0.4284,Negative,0.3,Neutral,0.2724007070064544,Neutral
I feel like this is like in 2025~2030,0.6124,Positive,0.0,Neutral,0.5819053649902344,Positive
i just realised that the fnaf sb song is a van halen song,0.0,Neutral,0.0,Neutral,-0.314594030380249,Negative
you are good at this game and you are not dumb you are smart and good at this game,0.8807,Positive,0.1669642857142856,Neutral,0.5804122090339661,Positive
my fav is glamRook  freddy,0.4588,Positive,0.0,Neutral,-0.3608141541481018,Negative
Yo mark your in 2027 💀 CRAZY,-0.4824,Negative,-0.6,Negative,0.65836501121521,Positive
there coming out with a movie in 2023,0.0,Neutral,0.0,Neutral,0.2781115174293518,Neutral
:0,0.0,Neutral,0.0,Neutral,-0.5527158975601196,Negative
Fun fact if you keep pressing the jump button while entering Freddy you can go through walls for a few more seconds,0.5106,Positive,0.1999999999999999,Neutral,0.4716425538063049,Positive
So in Monty room what you hear inside the vent Monty is breaking Bonnie is true or not,0.4215,Positive,0.35,Positive,0.3411518037319183,Positive
"10:59 ""Blocked on target ! Blocked on target !"" 😂😂",0.4912,Positive,0.0,Neutral,-0.8602967262268066,Negative
"christ, what a shit game",-0.5574,Negative,-0.3,Negative,-0.9333842396736144,Negative
I love your videos,0.6369,Positive,0.5,Positive,0.8285005688667297,Positive
totally not rewatching the series already,0.0,Neutral,0.0,Neutral,-0.6001042127609253,Negative
I watched this so i can see how scary it is bc im 10 and we just got a ps4 pro and i rill want security breach,-0.128,Negative,-0.5,Negative,0.2248334288597107,Neutral
Rewatching this bc I miss spending 12 hours watching markimoo and fnaf,-0.1531,Negative,0.0,Neutral,0.2879185676574707,Neutral
New sub never watched you first time watching you..!,0.0,Neutral,0.2244318181818181,Neutral,-0.4755842089653015,Negative
Hi,0.0,Neutral,0.0,Neutral,0.2364865690469741,Neutral
I finish the list and im rewatching Security Breach again🧌✨🤍,0.34,Positive,0.0,Neutral,-0.4135524928569793,Negative
Markaplier sounds just like Freddy 🤣,0.6908,Positive,0.0,Neutral,0.28740394115448,Neutral
I felt tears running down my my cheek🥲 I remember your first FNAF vid,-0.2263,Negative,0.0472222222222222,Neutral,-0.2242565304040908,Negative
Roxy has problems,-0.4019,Negative,0.0,Neutral,-0.3033908605575561,Negative
I Got FNAF SB Game😁,0.4588,Positive,0.0,Neutral,0.3299732506275177,Neutral
I always wanted to tell you I'm so sorry this is your job ❤,0.536,Positive,-0.5,Negative,0.4542961418628692,Positive
mark ❤❤❤❤,0.9571,Positive,0.0,Neutral,0.4597962200641632,Positive
"not gonna lie the first time I saw sb I was like ""sUnDrOp Is A bItCh""",-0.3182,Negative,0.25,Neutral,-0.486232191324234,Negative
the funny thing gregory should have broke a window to escape🤔,0.2023,Positive,0.25,Neutral,0.5080339908599854,Positive
"15:11 “ok thanks, also why? Also what? Also who? Also LET ME IN!!!”",0.6504,Positive,0.4453125,Positive,0.2832754254341125,Neutral
when Freddy said there was no rabbit anymore he was talking about bonnie,-0.296,Negative,0.0,Neutral,-0.376714825630188,Negative
When he said there is no rabbit at the pizza place he is talking about bonnie,-0.296,Negative,0.0,Neutral,-0.3347635567188263,Negative
I've watched the intro song 3 times and I love it,0.6369,Positive,0.5,Positive,0.8055329918861389,Positive
i mln likes lets goooooooooooooo markiplier,0.4215,Positive,0.0,Neutral,-0.3644415736198425,Negative
I just finished episode ten and im going to rewatch it and laugh at how clueless he is XD,0.7672,Positive,0.15,Neutral,-0.3032593429088592,Negative
currently rewatching this after some time & no one mentions how we literally see vanny in the recharge station 51:18 :o,-0.3818,Negative,0.025,Neutral,0.3010042011737823,Neutral
"No way this was 3 months ago, this video released before Christmas",-0.296,Negative,0.0,Neutral,-0.7598791718482971,Negative
"""i know exactly where i'm going, dO yOu?!""-mark 2021",0.0,Neutral,0.3125,Neutral,0.3901419639587402,Positive
Markiplier you will never believe it chica check on Freddy after he glitch,0.0,Neutral,0.0,Neutral,-0.3084968030452728,Negative
I turned the music of on mine and I can’t the intro,0.0,Neutral,0.0,Neutral,-0.379830926656723,Negative
1M wow,0.5859,Positive,0.1,Neutral,0.617177426815033,Positive
"Mark: sorry to bust your bubble but I am the best so you should shut up 

Roxane: your fans are watching you I know.",0.7684,Positive,0.25,Neutral,0.3186657130718231,Neutral
Totally not watching this over again after only 3 months,0.0,Neutral,0.0,Neutral,-0.7060655951499939,Negative
Freddy ur supposed too be on lock down!!!! U guys finish the rest,0.0,Neutral,0.0,Neutral,-0.521166980266571,Negative
mmm delicious frontal lobes,0.5719,Positive,1.0,Positive,0.4359647929668426,Positive
You should roast kids for content,0.0,Neutral,0.0,Neutral,0.3407371044158935,Positive
"Well that,s a suprise yeah no",0.4939,Positive,0.0,Neutral,-0.3998593986034393,Negative
How did I just get 3 ads of 15 seconds before I could even watch the video???? It’s kinda ridiculous how greedy yt is getting with these ads now.. it used to be 1 ad and skipable after 5 seconds😭,-0.8076,Negative,-0.3333333333333333,Negative,-0.4676663875579834,Negative
Okay I finally realized- Freddy’s voice reminds me of the Iron Giant,0.2263,Positive,0.1666666666666666,Neutral,0.832634449005127,Positive
Who else saw foxy at 42:24 ?,0.0,Neutral,0.0,Neutral,-0.4333054423332214,Negative
Kinda wish this game and future installments get released on current gen consoles soon enough. Fnaf series seems very good.,0.6808,Positive,0.1019999999999999,Neutral,0.635401725769043,Positive
"Me when I find this: Oh cool, there's another FNAF game. Maybe he rages a lot in this on-
(Sees game intro)
*I want to shot myself in the foot*",-0.128,Negative,-0.15,Negative,-0.3243911564350128,Negative
“Your mother?” Freddy fazbear 2022-2022,0.0,Neutral,0.0,Neutral,-0.2618797719478607,Negative
i didnt watch them before because  they came on school days,0.0,Neutral,0.0,Neutral,0.2808783650398254,Neutral
this is so nastalgic,0.0,Neutral,-0.5,Negative,-0.5270844101905823,Negative
coming back to this playthrough because i'm still obsessed with fnaf security breach months later and love markiplier's playthroughs,0.7096,Positive,0.0,Neutral,0.5093243718147278,Positive
He wants to smash Roxy I know it,0.0,Neutral,0.2,Neutral,-0.2489323765039444,Negative
This game gives me dream core vibes and I love it,0.7351,Positive,0.0499999999999999,Neutral,0.8440065979957581,Positive
This help a lot thanks I'm on the same one,0.6808,Positive,0.1,Neutral,0.6764267683029175,Positive
"I was eating a caramel magnum ice cream bar while i was watching the moondrop part, and i loved every second.",0.5994,Positive,0.35,Positive,0.6875626444816589,Positive
Moon was like SIKE! when you get 3 of 5 generators on,0.4199,Positive,0.0,Neutral,-0.3865299522876739,Negative
This series had me in an absolute choke grip when it first came out! This was the fist ever time I had ever turned on notifications for a video series and checked Mark’s page obsessively everyday for new uploads. I would literally shriek the moment the new video notification came in. Thank you Mark! Thank you so much!,0.2444,Positive,0.1448863636363636,Neutral,0.8265562057495117,Positive
I bought that game yesterday looking to play it later on tonight,0.34,Positive,-0.2,Negative,0.3940443992614746,Positive
*takes a nice piss to distract Chica*,-0.2732,Negative,0.6,Positive,0.4505519270896911,Positive
This reminds me a little bit of Alvin and the chipmunks cartoon on Nickelodeon the song from the beginning of the game,0.0,Neutral,-0.29375,Negative,0.4321204721927643,Positive
The fact he said to Roxanne that he is the best so Roxanne can shut up bro he dropped this 👑👑,0.6369,Positive,1.0,Positive,-0.2980119884014129,Negative
Add Cory to that throne,0.0,Neutral,0.0,Neutral,0.4170297980308532,Positive
why does freddy sound like the gy from no game?,0.0772,Positive,0.3,Neutral,-0.5534570217132568,Negative
Pee,0.0,Neutral,0.0,Neutral,0.2822337448596954,Neutral
Good night 🌉😪😪,0.4404,Positive,0.7,Positive,0.4306654334068298,Positive
Pizza hut on my way 🤣,0.4939,Positive,0.0,Neutral,0.5621562004089355,Positive
Moondrop sounds like he needs to cough,0.3612,Positive,0.0,Neutral,0.2843588590621948,Neutral
me coming back every so often to re-watch as if I didn't just watch it lol,0.4215,Positive,0.4,Positive,-0.2387624680995941,Negative
amongus,0.0,Neutral,0.0,Neutral,0.2487570792436599,Neutral
"anyone reads this, i am on a journey to watch every single video in this playlist. 95 episodes of mark, five nights at freddys, and me. I simply ask you pray for my safety",0.6249,Positive,-0.0357142857142857,Negative,-0.5702741742134094,Negative
Put age restrictions on your channel,0.0,Neutral,0.0,Neutral,0.3477703332901001,Positive
Markiplier being quiet in the fnaf security breach intro be like:*a moment of silents*,0.34,Positive,0.0,Neutral,0.229300394654274,Neutral
"**me vibin to the music**

**my sister violently shaking Bc of the flashing lights**

**thinking she’s just vibin**

**ded**",-0.6705,Negative,-0.8,Negative,-0.5159906148910522,Negative
5:57 freddy looks so cute waving,0.5949,Positive,0.5,Positive,0.5325882434844971,Positive
UwU,0.0,Neutral,0.0,Neutral,0.2725917398929596,Neutral
Sun takes care of  good kids,0.7269,Positive,0.7,Positive,0.4417884349822998,Positive
To take care of bad  kid,-0.0772,Negative,-0.6999999999999998,Negative,0.3634066581726074,Positive
Freddy is helping now? Hm I wasn’t cringe for so long that I forgot the dang lore,0.296,Positive,-0.05,Negative,0.2752761840820312,Neutral
42:32,0.0,Neutral,0.0,Neutral,0.2376988977193832,Neutral
"markipler:gets more scared at staff bot
also ,markiplyer:gets kinda scared by chika",-0.7003,Negative,0.5,Positive,0.4724932909011841,Positive
0:00 yen,0.0,Neutral,0.0,Neutral,-0.5718918442726135,Negative
thumbnails scarier than the game,0.0,Neutral,-0.4,Negative,0.3082606792449951,Neutral
"Mark: 'I see a red light there'
Moondrop: 'Defently not my eyes'",0.4019,Positive,0.1333333333333333,Neutral,-0.3372696042060852,Negative
Sorry mark but EddieVR is the king of fnaf:go check him out 👍,-0.0387,Neutral,-0.5,Negative,-0.2688829898834228,Negative
How do you not quit due being scared,-0.4404,Negative,-0.125,Negative,-0.3244811594486236,Negative
Bro when he is in the main lobby and he has the daycare pass that note said Dave it means Dave Miller,0.0258,Neutral,0.1666666666666666,Neutral,-0.4046045243740082,Negative
"11:32 
Markiplier: “And What’s Gonna Happen When I Do That?”
Me: “I DON’T KNOW AND I DON’T CARE HE SAID PLEASE NOW YOU HAVE TO LET HIM OUT!”",0.8052,Positive,0.0,Neutral,-0.5332627892494202,Negative
the year is 2024 tn sb,0.0,Neutral,0.0,Neutral,0.2484064400196075,Neutral
I love gregory is voice it's so cute and beautiful,0.9221,Positive,0.6166666666666667,Positive,0.8000105023384094,Positive
"""your fans are watching you right now"" 

Even if she spoke to herself, that's gotta be true about mark",0.4215,Positive,0.3178571428571428,Neutral,0.2360565066337585,Neutral
29:24,0.0,Neutral,0.0,Neutral,-0.2597878277301788,Negative
it took matpat 5 episodes to get to this,0.0,Neutral,0.0,Neutral,0.2671587765216827,Neutral
The daycare part was terrifying,-0.5719,Negative,-1.0,Negative,0.4213277101516723,Positive
this game is bad.,-0.5423,Negative,-0.5499999999999999,Negative,-0.7453858852386475,Negative
This game was pretty awesome,0.8074,Positive,0.2833333333333333,Neutral,0.6801401376724243,Positive
deltarune deltarune deltarune deltarune,0.0,Neutral,0.0,Neutral,0.3396294414997101,Positive
deltarune,0.0,Neutral,0.0,Neutral,0.3185923993587494,Neutral
I love your videos Mark player,0.6369,Positive,0.5,Positive,0.7948220372200012,Positive
Bro in Roblox in a game somebody made you fly,0.0,Neutral,0.2,Neutral,-0.303935170173645,Negative
New,0.0,Neutral,0.1363636363636363,Neutral,0.4850589334964752,Positive
How do u make ur gaming videos cuz I’m bew,0.0,Neutral,0.1363636363636363,Neutral,0.5101674795150757,Positive
"2:38 I cant be the only that thought the connection was weak because shitty internet makes it happen a lot, cmon",-0.7579,Negative,-0.1875,Negative,-0.3851845860481262,Negative
Kinda sucks ps4 got worst graphics this one look beautiful 😢,-0.6712,Negative,-0.15,Negative,-0.4189779460430145,Negative
"""was that the bite of 87?"" is your most infamous and incorrect statements ever made.",0.0,Neutral,0.0,Neutral,-0.7282370328903198,Negative
"FNAF SB: worst Rated of the FNAF games
Also FNAF SB: Most Played FNAF game",-0.3415,Negative,-0.3,Negative,-0.8051710724830627,Negative
I love how Freddy gave us the definition of a fountain 🤣,0.8126,Positive,0.5,Positive,0.7213958501815796,Positive
HOW DID YOU GET 1 MILLION LIKES IN THIS VIDEO AND YOU HAVE 32.5 MILLION SUBSCRIBERS HOLY S**T,0.5473,Positive,0.0,Neutral,-0.857302725315094,Negative
YOU CAN FLY?? mon be like yes.,0.6767,Positive,0.8,Positive,0.2495428621768951,Neutral
😂😂,0.7003,Positive,0.0,Neutral,0.3085779249668121,Neutral
put your hands together for the ONE THE ONLY freddyfazballs,0.0,Neutral,0.0,Neutral,0.5612954497337341,Positive
ahh yes the security breach intro where i kept saying WHERE FOXY AND BONNIE,0.6249,Positive,0.0,Neutral,-0.396150678396225,Negative
Not gonna lie you are kinda funny,0.3832,Positive,0.25,Neutral,0.4583101272583008,Positive
"I love your video I'm 9 my brother said that I should not watch you, but I do",0.3818,Positive,0.5,Positive,0.7978031635284424,Positive
HeLLo EvErYboDy My nAmE iS mArkipLier anD wElComE bAck tO FiVe nIghts At FrEdDy'S sEcUrity bReach,0.6597,Positive,0.4,Positive,-0.5552356839179993,Negative
HeLLo EvErYboDy My nAmE iS mArkipLier anD wElComE bAck tO FiVe nIghts At FrEdDy'S sEcUrity bReachHeLLo EvErYboDy My nAmE iS mArkipLier anD wElComE bAck tO FiVe nIghts At FrEdDy'S sEcUrity bReach,0.8689,Positive,0.4,Positive,-0.583138644695282,Negative
HeLLo EvErYboDy My nAmE iS mArkipLier anD ToDay wE aRe plAyiNg FiVe nIghts At FrEdDy'S sEcUrity bReach,0.4939,Positive,0.0,Neutral,-0.3818167746067047,Negative
HeLLo EvErYboDy My nAmE iS mArkipLier anD ToDay wE aRe plAyiNg FiVe nIghts At FrEdDy'S sEcUrity bReach,0.4939,Positive,0.0,Neutral,-0.3818167746067047,Negative
"Game instructions: create a distraction and don’t make a sound
Mark: (Rushes over)……HEYYYY  CHICA HOWS IT GOING!!",-0.2695,Negative,-0.3333333333333333,Negative,-0.4953090250492096,Negative
"Roxy: your fans are watching you right now
Me: well yes yes they are",0.7579,Positive,0.2857142857142857,Neutral,0.2608625888824463,Neutral
*26:23** WHY DID I JUMP???😭😭😭*,-0.8702,Negative,0.0,Neutral,-0.5368269085884094,Negative
the fact he thought chica was distroying her room lmao,0.0772,Positive,0.1999999999999999,Neutral,-0.2575751543045044,Negative
Can I join ur channel?,0.296,Positive,0.0,Neutral,-0.2840141057968139,Negative
BOP BOP BOP BOP BOP BOP BOP,0.0,Neutral,0.0,Neutral,0.3346883952617645,Positive
I know this game,0.0,Neutral,-0.4,Negative,0.6221106052398682,Positive
I remember getting a notification for this video and watching this video at 800 likes and 200 views 😂 and I'm rewatching this and it has 28 million views and 1 million likes which is madness and for some reason I think that this is the fastest Markiplier video to hit 1 million likes and hes most viewed video of 2021.,0.8126,Positive,0.5,Positive,-0.6091910600662231,Negative
"1, why is everything an animatronic. 2, Gregory screams ''Wait, I'm still in here'' and Freddy says to not draw attention to himself",-0.296,Negative,0.0,Neutral,-0.5062755346298218,Negative
Freddy looks fat when his chest is open,0.0,Neutral,0.0,Neutral,-0.3300889134407043,Negative
After revisiting FNaF 2-SL I decided to rewatch the whole playlist and I finally made it to Security Breach!,0.4003,Positive,0.1,Neutral,-0.3959673941135406,Negative
"Watching for a second time, it's weird that we don't see Gregory and he was just...inside a 1 cubic foot space in Freddy. Bit of a miss that there wasn't a twist use of that fact.",-0.3182,Negative,-0.25,Negative,0.3324497044086456,Positive
I quit because I can’t get passed the day care,0.4939,Positive,0.0,Neutral,-0.4676424264907837,Negative
Yeah,0.296,Positive,0.0,Neutral,0.3035990595817566,Neutral
It’s amazing how fnaf (an amazing series) started 7ys ago 😀,0.8779,Positive,0.6000000000000001,Positive,0.843021035194397,Positive
it is so funny when he gets scared,0.2123,Positive,0.25,Neutral,0.5107434988021851,Positive
"Me: casually making mini pizzas 
Mark In the background: *frustrated scared noises*

Edit: I burned my pizzas :') I go cri",-0.3182,Negative,-0.6000000000000001,Negative,-0.4512540996074676,Negative
But mark still somehow makes it good,0.5927,Positive,0.7,Positive,0.4710972309112549,Positive
Security breach sucks a is not scary!,0.4253,Positive,0.00625,Neutral,-0.6493516564369202,Negative
I love FNAF,0.6369,Positive,0.5,Positive,0.8040404319763184,Positive
"Glamrock Freddy: I feel that you are broken
Meanwhile fnaf 4: You are broken.

Thats just a theory, A GAME THEORY.",-0.7351,Negative,-0.4000000000000001,Negative,-0.4678556025028229,Negative
"""Freddy! You're supposed to be on lockdown!"" 
""But Vanessa... I have a Wedgy!",0.0,Neutral,0.0,Neutral,-0.3390109539031982,Negative
cool,0.3182,Positive,0.35,Positive,0.4904145896434784,Positive
I like Freddy he seems nice :),0.8074,Positive,0.55,Positive,0.5134040713310242,Positive
